ܡܚܨܐ	m x aː t͡ʃˤ eː
کمی	k ə m iː
گرڈ	ɡ ə ɽ ʊ ɖ
استفسار	i s t i f s aː r
שרב	ʃ a ʁ a v
یت	ɪ j ə t
خاله	x ɑː l a
ܛܠܝܐ	tˤ a l j aː
ܡܥܒܪܢܝܬܐ	m a b eː r a n iː θ a
غرفة	ɣ u r f a
ܡܣܡܣܡܢܐ	m ə s a m s ə m ɑː n ɑː
يوازېتو	j o ɑ z e t o
ܡܨܐ	m aː sˤ eː
ستونزو	s ə t u n z ə w
ܕܘܢܝܐ	d u n j eː
قوس	q a w i s a
بےدخلی	b eː d a x l iː
ژره	ʐ r ə
شمسي	ʂ m s i
بھوتنی	bʰ uː t ɪ n iː
دستاویز	d ʊ s t aː ʋ iː z
بخت	b a x t
ܬܘܕܝܬܐ	t a w d iː θ ɑː
ܦܛܪܝܩܐ	p a tˤ r iː q ɑː
طحين	tˤ a ħ iː n
ایران‌ویج	e ɾ ɑː n v e d͡ʒ
اصیل	ə s iː l
چوٹکی	t͡ʃʰ ʊ ʈ k iː
לשוני	l e ʃ o n i
ܣܒܝܪܐ	s ə w iː r ɑː
رازی	ɾ ɑː z iː
عقلۍ	ʕ q l ə i̯
ܬܦܨܝܠܐ	t a p sˤ iː l ɑː
کارگزاری	k a: r ɡ ʊ z a: r iː
وروڼو	w ə r uː n uː
نائٹ	n aɪ t
زیرقیادت	z i: r q iː a: d t
سندره	s n d r e
بوذا	b uː ð aː
ܣܦܩܐܝܬ	s ɑ pː q ɑː ʔ iː t
فرمانده	f a ɾ m ɑː n d i h
قونیه	ɢ u n i j a
شاهزادگان	ʃ ɑː h z ɑː d e ɡ ɑː n
کودنڈا	k ʊ d n ʊ n d a:
آخر	ʔ aː x a r
حاء	ħ aː ʔ
ܢܡܣܐ	n ɪ m s aː
اصول	ʊ s uː l
مورې	m w r e
موټرو	m w ʈ r w
ܗܕܟܐ	h a d x ɑː
تنازع	t ə n a: z oː ʔ
لكمة	l a k m a
کیږی	k i ʝ i
ځړول	t͡s ɽ u l
دجلة	d i d͡ʒ l a
حضور	h o z uː ɾ
مصروف	m ʊ s ɽ ʊ f
ومومئ	w m u m ʔ i
خبری	x a b a ɾ j a
زوو	z v oː
ܫܥܫ	ʃ ɑː ʔ ɪ ʃː
خزامى	x u z aː m aː
ريح	r a j j a ħ a
ململ	m ə l m ə l
مستنقع	m u s t a n q a ʕ
رنگین	ɾ a n ɡ i n
سخت	s a x t
سدر	s a d i r a
یوه	j o ə
مرگ	m a ɾ ɡ
عربز	ʕ a r b a z
حلتيث	ħ i l t iː θ
سیکھنا	s iː kʰ n a:
پدیده	p ə d i d ə h ə
ܟܘܬܐ	k oː t ɑː
הלחם	h e l χ e m
مخره	m x r ə
مار	m ɑː ɾ
پھاڑ	pʰ a: ɽ
سرو	s ə r o
چاق	t͡ʃ ɑː ɢ
ܡܐܣܐ	m ə ʔ a s s eː
محافظه‌کار	m o h ɑː f e z e k ɑː ɾ
جنائي	d͡ʒ i n aː ʔ i j j
کفر	k ə f ə r
مبارز	m u b aː r a z
دهان	d a h ɑː n
بونا	b o n ɑ
ناژو	n ɑː ʒ uː
دماغکې	d m ɑ ɣ k ɛ
قلقديس	q a l q a d iː s
ܓܝܠܣܬܐ	d͡ʒ iː l ɑ sː t aː
ܡܢܫܐ	m a n ʃ eː
غزہ	ɣ ə z ə
تعريف	t a ʕ r iː f
علف	ʔ a l a f
ܡܗܡܐ	m a h m eː
ܬܘܓܘ	t oː ɣ oː
ملف	m i l a f f
باروق	b aː r uː q
ولسوالۍ	w ə l ə s w ɑ l ə i
شماریدن	ʃ o m ɑː ɾ iː d a n
لتھوینیا	l ɪ tʰ ʊ eː n ɪ j a:
ܡܣܚܪ	m a s x ɪ r
جبت	d͡ʒ i b t
نیا	n ə j a:
خبر	x a b a ɾ
كثيراء	k a θ iː r aː ʔ
ܬܠܝܬܝܐ	t l iː t ɑː j ɑː
ܡܬܡܕܢܚܢܐ	m ɪ θ m a d n ə x ɑː n ɑː
بركار	b i r k aː r
مشغول	m a ʃ ɢ u l
سيف	s a j f
سليلة	s a l iː l a
ریکٹر	ɽ eː k t ɽ
ميېر	m j e r
إحاطة	ʔ i ħ aː tˤ a
اېکوادور	e k w ɑ d o r
غرض	ɣ ʊ r d z
حسینقلی	h o s e j n ɢ o l iː
ܬܠܐ	t ɑː l eː
خلنجان	x a l a n d͡ʒ aː n
گوشواره	ɡ oː ʃ v ɑː ɾ a
اطالیہ	ɪ t a: l ɪ j a: ɦ
ܓܘܢ	ɡ o nː
چاشت	t ʃ ɑː ʃ t
فراموشی	f a ɾ ɑː m oː ʃ iː
ܬܘ	t ɑ w
آویختن	ɑː v e x t a n
تجربې	t j r b e
کھنکنا	kʰ ə n ə k n a:
زیستن	z i s t a n
طاقتور	t a: q t ʋ ɔː ɽ
نبيه	n a b iː h
فعل	f a ʕ a l a
چنانچہ	t͡ʃ ʊ n a: n t͡ʃ a:
ابتر	ə b t ə ɽ
תשע	t e j ʃ a
چھونا	t͡ʃʰ uː n a:
بازو	b ɑ z u
کاغذ	k ɑː ɢ a z
استحم	i s t a ħ a m m a
بامداد	b ɑː m d ɑː n
پوهنه	p o h ə n a
محل	m a ħ a l l
سدارة	s a d aː r a
پالایش	p ɑː l ɑː j i ʃ
ہار	ɦ a: ɽ
قصه	ɢ i s s a
چاہت	t͡ʃ a: ɦ ə t
گلو	ɡ ʊ l oː , ɡ ʊ l uː , ɡ ə l uː
خواړه	x w ɑ ɻ a
ܐܦܓܢܣܛܢ	ʔ a f ɣ ɑː n ɪ s tˤ ɑː n
چوب	t͡ʃ oː b
خوشنویسی	x o ʃ n e v iː s iː
مرددوش	m a r d a d uː ʃ
دهیار	d e h j ɑː ɾ
يوازېتو	j o ɑ z e t o
اشترخار	o ʃ t o ɾ x ɑː ɾ
ژوپوهنه	ʒ o p o h ə n a
انحراف	ɪ n ɦ ɪ r a: f
کیمیاوی	k i m i ɑ w i
ـیسم	i s m
کبانو	k b ɑ n o
توسع	t a w a s s a ʕ a
کشیش	k a ʃ i ʃ
ترشی	t o ɾ ʃ iː
ܢܣܟ	n ɑː s e xː
کښتاندونیزیا	k ʂ t ɑː n d o n iː z iː ɑː
بھالو	bʰ a: l uː
خدا	x o d ɑː
بلاآواز	b a l a: a: ʋ a: z
بلکانټینر	b l k ɑː n t iː n r
لکهګرم	l ə k ə ɡ r m
تيش	t iː ʃ
اڑھا	a ɽʰ a:
بشیر	b ə ʃ iː ɽ
زینت	z eɪ n ə t
زمن	z a m a n
آزمایش	ɑː z m ɑː j i ʃ
خالو	x ɑː l uː
ڈھانک	ɖʰ a: n k
ونشي	w n ʃ i
ازاں	a: z a: n
ببر	b a b ɾ
ܫܥܬܐ	ʃ eː θ ɑː
أيهقان	ʔ a j h a q aː n
صغير	sˤ a ɣ iː r
زوئلا	z w ə l ɑ
اینٹورپن	ɛː n ʈ ʋ ə ɽ p ə n
مرحبا	m a r ħ a b aː
مسلې	m ə s l e
رهينة	r a h iː n a
התרפא	h i t ʁ a p e
ܚܝܐ	x a h eː
دھونا	dʰ uː n a:
صحیح	s ə ɦ iː
جیش	d͡ʒ æː ʃ
شګو	ʃ ɡ o
شاكرة	ʃ aː k i r a
سړي	s ə ɽ i
ہنگامہ	ɦ ʊ ŋ ɡ a: m ə
زحف	z a ħ a f a
ہدیۂ	ɦ ə d iː ə
لجن	l a d͡ʒ a n
بہار	b ə ɦ a: ɽ
دفاع	d e f ɑː ʔ
ܐܫ	ʔ ɪ ʃ
سلطنت	s ə l t ə n ə t
ژرف‌تر	ʒ a ɾ f t a ɾ
گنجشک	ɡ o n d͡ʒ e ʃ k
פי	p i
ثبت	s a b t
تمھارا	t ʊ m a: ɽ a:
חורף	χ o ʁ e f
کتب	k o t o b
گدا	ɡ ʊ d a:
توکي	t o k i
الآن	a l ʔ aː n a
شركة	ʃ a r i k a
استئمارة	i s t i ʔ m aː r a
متھرا	m ə tʰ ʊ ɽ a:
دلال	d a l l ɑː l
مباین	m ʊ b a: j n
خوراک	x o ɾ ɑː k
ٹھیس	ʈʰ iː s
کال	k ɑ l
مناسبت	m o n ɑː s e b a t
انوپ	a: n uː p
وضاحت	w ə z ɑ h ə t
أركن	ʔ a r k u n
جمله	d͡ʒ o m l e
شارجہ	ʃ a: ɽ d͡ʒ a: ɦ
نړۍ	n ə ɽ ə i
خودنویس	x o d n e v iː s
درنکړم	d r n k ɽ m
نیوه	n i o h e
جپنا	d͡ʒ ə p n a:
ترگمان	t a ɾ ɡ u m ɑː n
چپل	t͡ʃ ə p ə l
ویه	uː j e
کړل	k ɻ ə l
ژبپوهنه	ʒ ə b p o h ə n a
طلاق	t a l ɑː ɢ
تخریب	t̪ ə x r iː b
ܐܘܫܥܢܐ	o ʃ a ʕ n ɑː
پوهیږي	p o h i ʐ i
شورا	ʃ o o ɾ ɑː
چارې	t͡ʃ ɑ ɾ ɛ
ܝܡܝܢܐ	j a m m iː n ɑː
که	k e
عمیق	a m iː ɢ
שפשף	ʃ i f ʃ e f
اليسع	a l j a s a ʕ
سوپر	s uː p ɪ ɽ
ملیون	m l iː uː n
ناقص	n ɑː ɢ i s
سړى	s ʊ r i
زامبه	z ɑ m b a
تابع	t ɑː b i ʔ
ظهور	z o h uː ɾ
پښتنه	p a x t̪ a n a
بین‌المللی	b a j n a l m i l a l iː
عيش	ʕ a j ʃ
ماہ	m aː ɦ
ܫܠܡܐ	ʃ a l m ɑː
کوي	k o w i
رومی	ɾ oː m iː
ܥܛܡܐ	ʔ a tˤ m a
جلا	d ʒ ə l ɑ
گذاشتن	ɡ o z ɑː ʃ t a n
طائر	tˤ aː ʔ i r
جعضيض	d͡ʒ a ʕ dˤ iː dˤ
شرشيري	ʃ a r ʃ iː r i j j
نار	n ɑː ɾ
מקסיקו	m ɛ k s i k ɔ
بام	b ɑ m
سرو	s r o
اندازه	a n d ɑː z a
خلکو	x l k o
دقیق	d q i q
تكعيب	t a k ʕ iː b
بربخ	b a r b a x
ܡܝܟܐܝܠ	m iː x ɑː j e lː
ܩܕܡܝܬܐ	q a m eː θ a
پې	p e
موټرد	m o ʈ r d
داد	d ɑː d
امام	ɪ m a: m
غافت	ɣ aː f a t
لٹیرا	l ʊ ʈ iː ɽ a:
שחק	s a χ a k
نیول	n iː u l
لوڅ	l u t͡s
غلام	ɣ l ɑː m
ܬܠܦܐ	t ɪ l p ɑː
ܟܘܪ	t͡ʃˤ aː w ɪ r
ورکړحمي	w ɾ k ɾ ʔ h m i
گرجا	ɡ ɪ ɽ d͡ʒ a:
ܐܢܐ	ɑ n n e
چریک	t͡ʃ a ɾ i k
חבש	x ɔ v a ʃ
بےجا	b eː d͡ʒ a:
حکیم	h k i m
فرازمینی	f a ɾ ɑː z a m iː n iː
عنوان	o n v ɑː n
زرشك	z a r r a ʃ k
ܒܥܐ	b a ʔ eː
اچھا	ə t͡ʃ t͡ʃʰ a:
ديك	d iː k
בשל	b ə ʃ e l
شکلو	ʃ k l o
ܡܚܡ	m a x x ɪ m
گلہری	ɡ ɪ l ə ɦ ɽ iː
توفيق	t a w f iː q
גוף	ɡ u f
שקר	ʃ e k e r
انزعاج	i n z i ʕ aː d͡ʒ
אדם	a d a m
ܓܢܓܙ	d͡ʒ a n d͡ʒ ɪ z
صحاف	sˤ a ħ ħ aː f
חדש	χ a d a ʃ
بیابان	b i j ɑː b ɑː n
ܬܪܐ	t ɑː r eː
ܛܠܥ	tˤ aː l ɪ ʕ
השפעה	h a ʃ p a ŋ a
جاہی	d͡ʒ a: ɦ iː
ܫܡܐ	ʃ ɪ m m aː
حکومت	h k ʊ m t
طلاق	tˤ a l aː q
سرگرم	s ə ɽ ɡ ə ɽ m
نيابة	n i j aː b a
څاروى	t͡s ɑ r w a ɪ
خراسان	x o ɾ ɑː s ɑː n
آخرالزماں	a: x ɪ r a l z ʊ m a: n
آئٹمس	a: ɪ ʈ m s
بینالاقوامی	b eɪ n a: l a: q ʋ a: m iː
معنی	m uː ʕ n iː
اېموجي	e m o d͡ʒ i
الصين	a sˤ sˤ iː n
ماسٹر	m a: s ʈ ə ɽ
وړ	w ə ɻ
عنزروت	ʕ a n z a r uː t
זמזומילה	z i m z u m i l a
ادھو	a dʰ oʊ
رسېږئ	r s e ʐ ʔ
لازم	l ɑː z i m
ܡܣܙܓܪ	m ə s a z ɡ ɪ r
غالب	ɢ ɑː l e b
ܬܪܢܓܘܠܬܐ	t a r n u lː t ɑː
بارکزی	b ɑ r ə k z a i
آسيوي	ʔ aː s i j a w i j j
تنديل	t a n d iː l
מזל	m a z a l
تعزب	t a ʕ a z z a b a
ہلاکت	ɦ ɛː l a: k t
بركة	b a r a k a
ܗܘܝܐ	h ɑː w ɑː j ɑː
قبضہ	q ə b z ə
توان	t o ɑ n
بعث	b a ʔ s
ܫܟܠܐ	ʃ ɪ k l ɑː
ܡܒܝܢ	m a b j ɪ n
کړي	k ə ɽ i
منڈا	m ʊ n ɖ a:
پیښه	p iː x a
بنین	b e n iː n
ܛܦܝܬܐ	tˤ a p eː θ a
پراڈکٹ	p ɽ aː ɖ a k ʈ
خارج	x ɑː ɾ i d͡ʒ
شو	ʃ ʊ
مغز	m ɣ z
ܬܝܡܢܐ	t a j m n ɑː
بیرق	b a j ɾ a ɢ
مسلحانه	m o s a l l a h ɑː n e
پژوهش	p a ʒ u h i ʃ
زوج	z a v d͡ʒ
سیاه	s i j ɑː h
قرمزی	q ɪ ɽ m ɪ z iː
چی	t͡ʃ iː
برسر	b ə r s ə r
ܡܚܒܪ	m a x b ɪ r
خويندو	x w i n d o
רחוב	r ə ħ oː v
هنا	h u n aː
بنفشی	b ə n ə f ʃ iː
بی‌صراط	b e s i ɾ ɑː t
صدی	s ə d iː
لهشکه	l h ʃ k h
ابادول	a b ɑ d̪ a w ə l
مطالعه	m ə t̪ ɑ l ɛ h ə
خنصور	x a n sˤ uː r
کاګل	k ɑ ɡ ə l
تبا	t ə b ɑ
أطرش	ʔ a tˤ r a ʃ
مذمت	m ə z ə m ə t
واورې	w ɑ o r e
انکاؤنٹر	ɪ n k aʊ n t ɛ r
مسافت	m a s ɑː f a t
طريخ	tˤ a r r iː x
جگر	d ʒ e ɡ a ɾ
توارى	t a w aː r aː
مرمی	m a r m iː
مهندسی	m o h a n d e s iː
جرو	d͡ʒ a r w
چھوٹنا	t͡ʃʰ uː ʈ n a:
محبوب	m a h b u b
تمیز	t a m i z
متذکرہ	m ʊ t z ɪ k ɽ a:
ܩܢܘܢܐ	q ɑː n oː n ɑː
پجرنا	p ə d͡ʒ ɽ n a:
داستان	d a: s t a:
ܥܠܥܠܐ	ʕ a l ʕ ɑː l ɑː
ܡܠܠ	m a l l ɪ l
ܦܪܣܡܠܠܐ	p r ɑ sː m a l l ɑː l ɑ
אָ	a
محادثة	m u ħ aː d a θ a
ارمان	a r m ɑ n
أيقن	ʔ a j q a n a
ܐܦܘܟܕܘ	a f o k aː d oː
دریا	d a ɾ j ɑː
ܬܐ	t ɑː
مالکینو	m ɑ l k i n o
ܓܘܐܝܬ	ɡ ɑː w ɑː ʔ i θː
نکاح	n e k ɑː h
خادم	x aː d i m
پرابین	p ə ɽ aː b iː n
اتعاظ	i t t i ʕ aː ðˤ
آستین	a: s t iː n
ܬܫܕ	t͡ʃ ɑ ðː
بيلادونا	b iː l aː d uː n aː
تکوک	t a k oː k
كأب	k a ʔ b
بی‌شمار	b e ʃ u m ɑː ɾ
کبریت	k e b ɾ iː t
ہیک	ɦ iː k
خلافت	x ɪ l a: f ə t
ܙܕܥ	z ɑ dː d e ʔː
عظم	ʕ a ðˤ m
صیغه	s iː ɢ a
ہڑتالی	ɦ ə ɽ t a: l iː
یونان	j uː n a: n
یوم	j oː m
اوسطا	ɔː s t ə n
ܬܓܪܝܐ	t a ɡ ɡ ɑː r ɑː j ɑː
سید	s eː d
مسلمان	m ʊ s ə l m a: n
تعجب	t a ʔ a d d͡ʒ u b
افغانستان	a f ɣ ɑ n ɪ s t ɑ n
שקיעה	ʃ k i j ʕ a
ܝܬܝܪܐ	j a t t iː r ɑː
سرنديب	s a r a n d iː b
ګاډی	ɡ ɑ ɖ a ɪ
جارجن	d͡ʒ a: r d͡ʒ ə n
تیهو	t i h s
ترسانة	t a r s aː n a
میدان	m eː d a: n
يتيم	j a t iː m
مسلمانو	m ə s l i m ɑ n w
نخیر	n a x a j ɾ
مولا	m ɔː l a:
چمیدن	t͡ʃ a m i d a n
شهادت	ʃ a h ɑː d a t
هنوز	h a n oː z
ܡܬܠ	m a t t ɪ l
آرام	ɑː ɾ ɑː m
تناعس	t a n aː ʕ a s a
ܦܠܚ	p aː l e xː
ܫܠܝܨܐ	ʃ l iː sˤ aː
ہاتھ	ɦ a: tʰ
عجبه	ʕ ɪ ʤ b ə
ځلانده	ʐ l ɑ n d ə
ܢܣܘܟܬܐ	n ɑː s o xː t ɑː
ܡܬܚܙܐ	m ɪ θ ħ ə z eː
قانون	q ɑː n uː n
خوري	x o r i
تو	t o
راوړل	r ɑ w ɽ ə l
کلتور	k ʊ l t̪ u r
گھڑیال	ɡʰ ə ɽ ɪ j a: l
مړې	m ə ɽ e
ܕܪܟ	d ɑː r e xː
نذرآتش	n ɛː z ɽ a: t ɪ ʃ
ܩܢܝܢܬܐ	q a n i nː t ɑː
סקסי	s e k s i
فصل	f a s l
صحنه	s a h n e
نیایش	n i j ɑː j i ʃ
ܪܡܐ	r ɑː m eː
برخوردار	b a ɾ x o ɾ d ɑː ɾ
ܦܫܩ	p a ʃ ʃ ɪ q
وچکړه	w t͡ʃ k ɻ a
لهجه	l a h d͡ʒ a
آتما	a: t m a:
ܡܪܘܚܬܐ	m a r w a x t ɑː
ܣܢܐܓܪܬܐ	s n iː ɣ a r t ɑː
قدوم	q a d d uː m
طیرانگاہ	ʈ iː ɽ a: n ɡ a: ɦ
פלשתינה	p a l e s t i n a
بلغم	b a l ɣ a m
تقيأ	t a q a j j a ʔ a
ܟܢܘܢܐ	k a n uː n eː
جادو	d͡ʒ a: d uː
הודעה	h o d a ʔ a
أدب	ʔ a d a b
توان	t̪ o ɑ n
تنیدن	t a n iː d a n
ثانيه	θ ɑː n iː ə
قاسمی	q aː s m iː
زاغ	z aː ɣ a
لاہور	l ə ɦ oː ɽ
دورلیکھ	d uː ɽ l eː kʰ
ܡܪܣܣܢܐ	m r a s s ɑː n ɑː
مہنگائی	m ə ɦ ə ŋ ɡ a: iː
جلب	d͡ʒ a l a b
قفلوط	q a f a l uː tˤ
زخات	z a x x aː t
غیرانسانی	ɣ ɛː r ɪ n s a: n iː
ܚܘܪܬܐ	x w a r t ɑː
عصبانی	a s a b ɑː n iː
ܣܝܫܠܝܣ	s eː ʃ e l l iː s
ذات	z a: t
غسالة	ɣ a s s aː l a
ܫܩܩܐ	ʃ q ɑː q ɑː
نادان	n ɑː d ɑː n
عجاوة	ʕ u d͡ʒ aː w a
کوره	k oː ɾ a
ژاژ	ʒ ɑː ʒ
مورد	m a w r i d
طبقہ	ʈ ə b q ə
إيريناوس	ʔ iː r iː n aː w u s
سرشپ	s ə ɽ ʂ ə p
قال	q aː l
حکایت	h e k ɑː j a t
سو	s u
شبھ	ʃ ʊ bʰ
شاهنامه	ʃ ɑː h n ɑː m a
سید	s a j j i d
مؤذن	m ʊ ə z z ɪ n
تألق	t a ʔ a l l a q a
ܚܡܬܐ	x a m θ ɑː
צחק	t͡s a χ a k
دنب	d o n b
بیه	b i h e
گیسو	ɡ e s u
فتح	f a t a ħ a
پیلاگو	p iː l aː ɡ oː
ثروت	s a ɾ v a t
مختبر	m u x t a b a r
مقصف	m a q sˤ a f
ܐܝܛܠܝܐ	ʔ iː tˤ ɑː l iː j ɑː
مرغ	m r a ɣ
دجلہ	d ə d͡ʒ l a:
صورتی	s uː ɾ a t iː
ܫܩܠ	ʃ ɑː q e lː
אחז	a ħ a z
ہوس	ɦ ə ʋ ə s
گج	ɡ ə d͡ʒ
راہبہ	ɽ a: ɦ ɪ b a:
ریختہ	ɽ eː x t a:
يوولس	j a w o l a s
مفاہمانہ	m ʊ f a: ɦ m a: n a:
اوسسطل	a w s s t̪ l
تترى	t a t r aː
کیمیا	k iː m ɪ j a:
غور	ɣ o r
معبد	m a ʔ b a d
طاق	t a: q
سیستم	s iː s t e m
ویشي	w i ʂ i
څښتن	ʈʂ x t n
ارگ	o ɾ ɡ
حديد	ħ a d iː d
سؤر	s uː ə ɽ
مقود	m i q w a d
ܦܘܫܝܐ	f uː ʃ i j ɑː
ماریشیس	m a: r iː ʃ iː s
لشکر	l a ʃ k a ɾ
اضافه	e z ɑː f e
دویدن	d a v i d a n
وزیر	ʋ ə z iː ɽ
اعتماد	e ʔ t e m ɑː d
شا	ʃ ɑː
ساعت	s ɑː ʔ a t
ܡܪܟܫܝܐ	m a r r ɑː k ə ʃ ɑː j ɑː
ܡܚܕܝܐ	m ɪ x d ɑː j ɑː
مٹانا	m ɪ ʈ a: n a:
بنیاد	b o n j ɑː d
دور	d uː ɽ
موجھی	m oʊ d͡ʒʰ iː
احباب	ə ɦ b a: b
خورم	x o r m
ܡܚܠܠ	m ə x a l l ɪ l
ارمان	ə ɽ m a: n
فضازمان	f a z ɑː z a m ɑː n
امتحان	ɪ m t ɪ ɦ a: n
جاننا	d͡ʒ a: n n a:
امريکا	a m r i k ɑ
گوهر	ɡ a v h a ɾ
ناورین	n ɑ w ɾ iː n
ܓܢܕܘܪܐ	d͡ʒ i n d uː r ɑː
سنبوسه	s a m b oː s a
تبريز	t a b r iː z
شاعرہ	ʃ a: j ɽ a:
زوئلا	z w ʔ l a
ܒܒܐ	b ɑː b ɑː
ګۍ	ɡ e
اوښلرم	a w ʈ͡ʂ l r m
الأشهل	a l ʔ a ʃ h a l
آخن	ʔ aː x a n
کینه	k iː n e
افرادو	ɑ f r ɑ d o
حماق	ħ a m aː q
ہرانا	ɦ ə ɽ a: n a:
ܢܒܝܐ	n v iː j aː
טורסו	t ɔ ʁ s ɔ
שיבולת	ʃ i b o l e t
קין	k a j i n
ویٹ	ʋ eɪ t
گره	ɡ e r e h
فضائي	f a dˤ aː ʔ i j j
غښتل	ɣ ə x t̪ ə l
ܡܬܚܡܐܝܬ	m ə t a x m ɑː ʔ i θː
مومیایی	m oː m i j ɑː j iː
טלפון	t e l e f o n
فرانس	f ɽ a: n s
پسهٔ	p s ə
جانکاری	d͡ʒ a: n k a: ɽ iː
ܒܬܪ	b a r
جدید	d͡ʒ a d i d
آگاه	ɑː ɡ ɑː h
فرمائش	f ə ɽ m a: ɪ ʃ
أكاف	ʔ u k aː f
چینی	t͡ʃ i n iː
وروسته	w o r o s t ə
جلنا	d͡ʒ ə l n a:
ܥܬܩܐ	ʕ ɪ t q ɑː
برڈ	b ɽ ʊ d
وکړئیا	w k ɽ ə i ɑ
ܢܐܦܘܠܝܣ	n e ʔ ɑː p oː l i sː
ܡܕܥܪ	m a d ɪ r
اختصار	e x t e s ɑː ɾ
ܡܠܕ	m a j l ɪ d
موسم	m a w s i m
تراب	t u r aː b
تسكع	t a s a k k a ʕ a
الشمس	ʔ ə l ʃ ə m s
خانگی	x ɑː n a ʔ ɡ iː
ہونا	ɦ oː n a:
اهریمن	ʔ a h ɾ iː m a n
شو	ʃ oː
ܦܚܡܐ	p a x m ɑː
نڅا	n ʂ ɑ
پنگھٹ	p ə ŋ ɡʰ ə ʈ
קול	k o j l
راولي	r ɑ w ə l i
بزرگ‌امید	b o z o ɾ ɡ ʔ o m iː d
عبدالعزیز	a ʊ b d ʊ l a ʊ z iː z
لاسه	l ɑ s ə
أهلي	ʔ a h l i j j
ښوونکې	x o w u n k e
ܓܠܣ	ɡ l ɑː s
القاهرة	a l q aː h i r a
رياضة	r i j aː dˤ a
כנסת	k n e s e t
زیانهم	z j ɑ n ɛ h m
وزراء	w u z a r aː ʔ
عجور	ʕ a d͡ʒ d͡ʒ uː r
کردن	k a d a n
نشادر	n u ʃ aː d i r
ܡܝܩܪܬܐ	m j a q q a r t aː
كابل	k aː b u l
روشنگری	ɾ a v ʃ a n ɡ a ɾ iː
فودنج	f uː d a n a d͡ʒ
لیمو	l i m u
قعد	q a ʕ a d a
کھلواڑ	kʰ ə l ʋ a: ɽ
رضى	r u dˤ aː
مدیریت	m ə d i r i t
توګه	t̪ o ɡ e
ܗܠܟ	h ɑː l e xː
ויקיפדיה	v i k i p e d j a
كفالة	k a f aː l a
ضيون	dˤ a j w a n
پور	p u ɾ
پاکوونکو	p ɑ k o w n k o
ܬܠܓ	t ɑː l e ɣː
تفاف	t i f aː f
حاذق	ħ aː ð i q
انگلیس	ʔ e n ɡ e l iː s
مقاله	m a ɢ ɑː l a
جدوى	d͡ʒ a d w aː
کېږ	k e ʐ
ددې	d d e
هريرة	h u r a j r a h
وعده	v a ʔ d a
فلز	f i l a z z
یاد	j ɑː d
خيدک	x a i d ə k
ריפוד	r i p u d
יוכבד	j o χ e v e d
لحلاح	l a ħ l aː ħ
انسان	ɑ n s ɑ n
ډاډ	ɖ ɑ ɖ
جحر	d͡ʒ u ħ r
ګردی	ɡ ə r d̪ a i
غره	ɢ a ɾ ɾ e
ذات	z ɑː t
نیوشا	n i j oː ʃ ɑː
میلیونو	m i l i w o n w o
بوټپوهنه	b u ʈ p o h ə n a
ܡܟܠܟܠ	m ə k a l k ɪ l
نیرومند	n iː ɾ uː m a n d
ܐܫܛܪܐ	ʔ ɪ ʃ tˤ ɑː r ɑː
أبث	ʔ a b a θ a
صفر	sˤ a f a r
سه‌بعدی	s e b o ʔ d iː
دړد	d̪ ə ɺ ˞ d̪
شیدې	ʃ i d e
للأسف	l i l ʔ a s a f
اشتباه	e ʃ t e b ɑː h
کوچني	k o t͡ʃ n i
هڅې	h ə t͡s e
مشرقی	m a ʃ ɾ i ɢ iː
تیرھواں	t ɪ ɽ ʊ ʋ a: n
ܡܚܪܬܝܢ	m x ɑ rː θ e nː
گھڑی	ɡʰ ə ɽ iː
څرخیدو	ʂ r x iː d oː
اختیار	e x t i j ɑː ɾ
ܡܪܝ	m a r
تباه	t a b ɑː h
تماشى	t a m aː ʃ aː
غلام	ɢ o l ɑː m
بلین	b ɛː l iː n
کسانو	k s ɑː n uː
הזכיר	h i z k i ʁ
تقدم	t a q a d d a m a
جایگاه	d͡ʒ ɑː j ɡ ɑː h
ادبیات	a d a b i j ɑː t
سوار	s ʋ a: ɽ
نهو	n ɛ h o
خوندي	x o n d i
ܥܒܘܝܐ	ʔ ɪ b b oː j a
غزال	ɢ a z ɑː l
پیرتر	p iː ɾ t a ɾ
چم	t͡ʃ m
ܨܢܕܘܩܐ	sˤ a n d uː q ɑː
ښکلی	x k w ə l a i
قناع	q i n aː ʕ
مکہ	m ə k ə
ملعقة	m i l ʕ a q a
پیروي	p i r o i
ܓܫܪܐ	d͡ʒ ɪ ʃ r ɑː
دوام	d o ɑ m
اصهب	i sˤ h a b b a
זהיר	z a h i ʁ
إنما	ʔ i n n a m aː
دستگاه	d a s t ɡ ɑː h
وسیع	ʋ ʊ s iː a
جڑواں	d͡ʒ ʊ ɽ ʋ a:
فرق	f ɽ q
ܓܠܐ	d͡ʒ ɑː l eː
جہازی	d͡ʒ ə ɦ a: z iː
ڈاکٹر	ɖ a: k ʈ ə ɽ
زره	z e ɾ e h
تندرست	t ə n d ʊ ɽ ʊ s t
ܐܟܘܡܬܐ	k a m t a
اتفاق	e t t e f ɑː ɢ
زينب	z a j n a b
ټولد	ʈ o l d
ܙܝܡܒܒܘܐ	z i mː b ɑ bː w eː
سرچشمه	s a ɾ t͡ʃ a ʃ m a
څاوار	t͡s ɑ w ɑ r
مغبن	m a ɣ b a n
پھول	pʰ uː l
شعير	ʃ a ʕ iː r
مناعة	m a n aː ʕ a
نانوشته	n ɑː n i v i ʃ t a
گزینش	ɡ o z iː n e ʃ
ناخوذاة	n aː x uː ð aː h
سفیر	s a f i ɾ
ܟܟܚܐ	k ə t͡ʃ ɑː x ɑː
ܥܘܪܦܢܐ	ʕ u r p ɑː n ɑː
توسط	t a v a s u t i
اٹاچی	ə ʈ ɛː t͡ʃ iː
فعالیت	f a a: l iː t
شنو	ʃ n oː
إبريز	ʔ i b r iː z
ܫܓܠ	ʃ ɑː ɣ ə l
جوزل	d͡ʒ a w z a l
إفادة	ʔ i f aː d a
مكسرات	m u k a s s a r aː t
مسئلہ	m ə s l a:
زمرۍ	z m a r ə i
پری	p a ɾ iː
گندمی	ɡ ə n d ʊ m iː
نهو	n h o
ولاړ	w o l ɑ ɻ
ګيټۍ	ɡ i ʈ ə i
ابتذل	i b t a ð a l a
ډا	ɖ ɑ
افتقد	i f t a q a d a
أوج	ʔ a w d͡ʒ
ܟܡܒܘܕܝܐ	k ɑ mː b oː ð iː j ɑː
ډاډ	ɖ ɑː ɖ
ܒܨܐ	b aː sˤ eː
باعزت	b a: a ɪ z z ə t
تازه	t ɑ z a
سويمور	s ʋ ə j ə m ʋ ə ɽ
ساینس	s ɑ i n s
غوښتنه	ɣ w ɔ x t ə n ə
خشاب	x e ʃ ɑː b
ܐܢܓܠܝܣܝܐ	ʔ ɪ ŋ ɡ l iː s ɑː j ɑː
پختن	p o x t a n
صاحب	sˤ aː ħ i b
ورزش	ʋ ə ɽ z ɪ ʃ
ܩܘܕܡܐ	q u d m eː
ماته	m ɑ t ə
گریستن	ɡ e ɾ iː s t a n
ܬܫܥܡܐܐ	t ə ʃ a ʕ m ə ʔ ɑː
میلادی	m iː l ɑː d iː
زیست‌شناسی	z iː s t ʃ e n ɑː s iː
להקה	l a h a k a
چونګښې	t͡ʃ uː ŋ x e
مکل	m ʊ k l
وړوکی	w a ɺ̢ u k a i
اجتماع	ɪ d͡ʒ t ɪ m aː a
خنډ	x n ɖ
باغبان	b ɑː ɢ b ɑː n
ܫܡܥܚܙܘܝܐ	ʃ ɪ m ʕ ə x ɪ z w ɑː j ɑː
سورلنډی	s u r l ə n ɖ a i
أنيسون	ʔ a n iː s uː n
مسطرة	m i s tˤ a r a
برچھیت	b ə ɽ t͡ʃʰ ɛː t
ܦܠܓ	p ɑː l e ɣː
تکیه	t̪ ə k i j ə
قوة	q u w w a
خواب	x a: b
أصف	ʔ a sˤ a f
ظمئ	ðˤ a m i ʔ a
ماهر	m ɑː h ə r
پریت	p ə ɽ iː t
ܠܩܛ	l a q q ɪ tˤ
بدمخی	b ə d m ə x a i
کاروان	k ɑː ɾ v ɑː n
کنواری	k ʊ ʋ a: ɽ iː
دروغویلو	d r uː ɣ w iː l u
پڑھنا	p ə ɽʰ n a:
فرغة	f a r i ɣ a
وسط	v a s a t
ستړیا	s t ɻ i ɑ
סיפק	s i p ɛ k
عنى	ʕ a n aː
أردمون	ʔ a r d a m uː n
لكنة	l u k n a
موقع	m ɔː q a:
معطس	m a ʕ tˤ i s
جھانجھ	d͡ʒʰ a: d͡ʒʰ
מצרים	m i t͡s ʁ a j i m
مشاور	m o ʃ ɑː v e ɾ
ܥܝܪܩ	ʔ i r ɑː q
ܢܘܒܐ	n oː b ɑː
نحاس	n u ħ aː s
روبہ	r oː b a:
احترق	i ħ t a r a q a
ܡܚܘܪ	m a x w ɪ r
استفسار	a s t a f s aː r
تنبول	t u m b uː l
کم	k a m
ترمس	t i r m i s
ُته	ʔ t̪ ə
فضي	f i dˤ dˤ i j j
شنبلیله	ʃ a m b a l iː l e
انگوٹھا	ə ŋ ɡ uː ʈʰ a:
ܟܘܢܓܘ	k o ŋː ɡ oː
ډای	ɖ ɑ i
دیا	d ɪ j a:
غیرمستحکم	ɣ ɪ r m ʊ s t ɦ a k a m
اورګاډی	o r ɡ ɑ ɖ a ɪ
رغوة	r a ɣ w a
ریاضی	ɽ ɪ j a: z iː
ایران	e ɾ ɑː n
رغف	r u ɣ u f
بنده	b a n d̪ a
תרועה	t a r u ʕ ɔ
خوبۍ	x o b ə i
الداخلہ	ʔ ɛː l d a: x l a:
دیوان	d e v ɑː n
شایعه	ʃ ɑː j i ʔ a
انفراسٹرکچر	ɪ n f r a: s t ɽ ʊ k t͡ʃ ʊ ɽ
ܪܕܝܬܐ	r a d d eː t ɑː
خانوادگی	x ɑː n a v ɑː d a ɡ iː
حيوان	ħ a j a w aː n
خسرو	x ʊ s ɽ oː
میهن	m e h a n
ران	ɾ ɑː n
کرانیکل	k ə r a: n iː k ə l
تأسف	t a ʔ a s s a f a
اقلیت	a ɢ a l l i j a t
سيس	s a j j a s a
صابون	s ɑː b uː n
کیول	k eː ʋ ə l
جیب	d͡ʒ iː b
ارتش	a ɾ t i ʃ
חורפים	χ o ʁ a f i m
ـی	e
منشي	m ə n ʃ i
مرغان	m o ɾ ɢ ɑː n
מלוח	m a l u a χ
أخصائي	ʔ a x i sˤ sˤ aː ʔ i j j
نظريه	n ə z ə r i j ə
کرفس	k a ɾ a f s
مسدس	m u s a d d a s
بندول	b a ŋ d̪ ə w ə l
ملکه	m a l i k a
شکم	ʃ e k a m
ܒܪܝܐ	b a r r iː j ɑː
صنعتونو	s n ʕ ə t̪ o n o
پیسه	p a j s a
هنرونو	h n r o n o
افغانستان	a f ɢ ɑː n i s t ɑː n
تودوخې	t o d o x e
حیوان	ħ i w ɑ n
قول	ɢ a v l
مروحة	m i r w a ħ a
ځکمی	ʈʂ k ə m i
وګټو	w ɡ ʈ o
کشکول	k a ʃ k uː l
מערך	m a ʔ a ʁ a χ
سینه	s i n a
ذكر	ð a k a r
قلیان	ɢ a l j ɑː n
آژیر	ɑː ʔ ʒ iː ɾ
ایٹمی	ɛː ʈ m iː
پرواۍ	p r w ɑ e
مختلط	m o x t a l e t
کېږيو	k e ʐ i o
قانعکړي	q ɑ n ʕ k ə ɽ i
ميز	m a j j a z a
غونډاری	ɣ u n ɖ ɑ r a i
گراز	ɡ o ɾ ɑː z
ܒܪܟ	b a r r ɪ x
رشد	ɾ o ʃ d
پٹنہ	p a t n a:
کنکور	k o n k uː r
מתתיהו	m a t i t j a h u
ونا	ʋ ɪ n a:
ژکفر	ʒ a k f a ɾ
سرحد	s a ɾ h a d
ورسیده	w r s i d h
نگار	n e ɡ ɑː ɾ
ډولو	ɖ o l o
نور	n u ɾ
داروسازی	d ɑː ɾ uː s ɑː z iː
یات	ɪ j a: t
تاجیکستان	t ɑː d͡ʒ iː k i s t ɑː n
سبأ	s a b a ʔ
صهیونیسم	s a h j u n i s m
اص	ɑ s
داتوازن	d ɑ t w ɑ z n
دلیلونه	d l iː l uː n ə
پینسل	p eː n s ə l
ܟܠܒܐ	k a l b ɑː
سلام	s a l aː m
ارجن	ə ɽ d͡ʒ ʊ n
فعلا	f e ʔ l a n
نفاخة	n u f f aː x a
کړئ	k ɻ ə
ܟܪܘܛܝܐ	k r o aː tˤ i j aː
حیران	ɦ ɛː ɽ a: n
דיר	d i ʁ
انكمش	i n k a m a ʃ a
کتل	k a t ə l
بستی	b ə s t iː
ولېږل	w l e ʐ l
جالڅخه	d͡ʒ a l t͡s x a
سنجاب	s a n d͡ʒ ɑː b
یا	j a:
اشخاصو	ɑ ʃ x ɑ s ə w
ہوا	ɦ ə ʋ a:
لوري	l oː r iː
ܣܡܘܩܬܐ	s m a q t a
طرف	t̪ ɾ ə f
ځواب	ʣ w ɑ b
דבק	d a v a k
نمبیار	n ə m b j aː r
پورته	p ʊ r t ə
עמורה	ɣ ɑ m oː r ɑ
ځیږ	z i ɡ
مدلجة	m i d l a d͡ʒ a
كفاح	k i f aː ħ
ܣܘܕ	s a w w ɪ d
بحران	b o h ɾ ɑː n
افطار	e f t ɑː ɾ
مليء	m a l iː ʔ
حیواناتو	x i j w ɑ n ɑ t̪ o
ܕܟܢܐ	d i k k ɑː n ɑː
پېړۍ	p e ɻ ə i
آباد	ɑː b ɑː d
یخچال	j a x t͡ʃ ɑː l
جبران	d͡ʒ o b ɾ ɑː n
مسموم	m ə s m o m
شهادة	ʃ a h aː d a
مسد	m a s a d a
نقيض	n a q iː dˤ
تدبیر	t ə d b iː ɽ
کنشگر	k o n e ʃ ɡ a ɾ
ܫܘܝܨܪܝܐ	ʃ ə v a j sˤ r ɑː j ɑː
شپش	ʃ e p e ʃ
بیرونی	b e ɾ uː n iː
زیرمه	z i r m ə
ظلف	ðˤ i l f
صيدلية	sˤ a j d a l i j j a
فنڈ	f ʊ n ʈ
ققنوس	ɢ u ɢ n u s
سامان	s ɑː m ɑː n
گوشه	ɡ oː ʃ a
رات	ɽ a: t
ܒܝܥܬܐ	b eː t ɑː
أحاط	ʔ a ħ aː tˤ a
آشکارا	a: ʃ k a: ɽ a:
واټن	w ɑ t̪ n
نجار	n a d͡ʒ d͡ʒ aː r
أوحد	ʔ a w ħ a d
اويو	oː iː oː
بیمار	b e m ɑː ɾ
ורד	v ɛ ʁ ɛ d
