جھونکا	d͡ʒʰ uː n k a:
ܡܚܦܪܦ	m x a p r ɪ p
סעודה	s e ʔ u d a
لنگر	l a n ɡ a ɾ
شهوت	ʃ a h v a t
طبيبة	tˤ a b iː b a
אויב	o j e v
امین	a m iː n
تفاوض	t a f aː w a dˤ a
شهری	ʃ a h ɾ iː
شعب	ʃ a a b
استفز	i s t a f a z z a
نن	n ə n
زه	z ə
جبار	d ʒ a b ɑː ɾ
ܐܘܪܢܘܣ	ʊː r ɑː n o s
کړک	k ɻ k
قینچی	q ɛ: t͡ʃ iː
وخندل	w x n d l
مخه	m x a
بدلېدل	b a d l e d ə l
رپورٹرس	ɽ ə p ɔː r ʈ ə r s
مشاعر	m a ʃ aː ʕ i r
نعال	n i ʕ aː l
משוש	m a s o s
هرکله	h ə r k ə l ə
تعليق	t a ʕ l iː q
סדן	s a d a n
ټولو	ʈ o l o
کوی۶	k oː ɪ a 6
אתה	ʔ a t a
سنجیدگی	s ʊ n d͡ʒ iː d ɡ iː
ܡܘܠܕܢܐ	m ɑ w l d ɑː n ɑː
رکھا	ɽ ʊ kʰ a:
ځایونو	ʐ ɑː j w n w
بٹورنا	b ə ʈ oː ɽ n a:
بلور	b i l oː ɾ
صورتى	s u ɾ a t iː
شخص	ʃ a x s
نزد	n a z d
بمقابلہ	b ə m q a: b l ə ɦ
هوښيارزیرک	h ʊ x j ɑː r z iː r k
اسپاٹ	ɪ s p a: ʈ
داروشناس	d ɑː ɾ uː ʃ i n ɑː s
جانرك	d͡ʒ aː n a r i k
ہمنوائی	ɦ ə m ‿ n ə ʋ a: iː
شوې	ʃ o w e
گھاو	ɡʰ a: ʋ
התאבד	h i t ʔ a b e d
غوږ	ɣ w a ɡ
فاخره	f ɑː x i ɾ a
ولیده	w l i d h a
فريسة	f a r iː s a
چند	t͡ʃ a n d
ستوری	s t̪ o r a ɪ
شکتی	ʃ ə k t iː
ܕܠܠ	d a l l ɪ l
سستی	s ʊ s t iː
سوخته	s uː x t e
سرخ	s o ɾ x
پرتوګ	p a r t̪ u ɡ
موندلو	m u n d ə l ə w
کارنی	k aː r n iː
ܩܝܕܡܬܐ	q a d a m t a
ویښتان	w iː x t aː n
ܨܝܢܐ	sˤ iː n ɑː
تساوى	t a s aː w aː
طمطراق	t o m t o ɾ ɑː ɢ
مقبوض	m ə q b uː z
احتكار	i ħ t i k aː r
آدھنک	a: dʰ ʊ n ɪ k
ژنو	ʒ e n e v
مرغان	m r ɣ ɑ n
تندرستی	t ə n d ʊ ɽ ʊ s t iː
سکه	s a k a
چلچتر	t͡ʃ ə l t͡ʃ ɪ t ɽ ə
سیماب	s i m ɑː b
ܓܘܢܚܐ	d͡ʒ u n x ɑː
مصفاة	m i sˤ f aː h
خرگوش	x a ɾ ɡ oː ʃ
پیغام	p i ɣ ɑ m
گزیدن	ɡ a z i d a n
תמונה	t m u n a
همچنین	h a m t͡ʃ a n i n
ہانک	ɦ a: k
سوسن	s oː s a n
نور	n ʊ r
ٹرانزیشنل	ʈ r a: n z iː ʃ a n l
حراست	ɦ ɪ ɽ a: s ə t
ܟܠܟ	k a l ɪ k
دستاویزی	d ə s t a: ʋ iː z iː
دفلى	d i f l aː
معلومه	m a l o m h
بوصير	b uː sˤ iː r
جاهل	d͡ʒ ɑː h i l
ܚܓܐ	ħ ɪ ɡ ɡ aː
عزيز	ʕ a z iː z
بناية	b i n aː j a
موظف	m ʊ z ə f
مجازر	m a d͡ʒ aː z i r
فهم	f a h m
احتیاج	e h t i j ɑː d͡ʒ
بکم	b ʊ k m
ܩܐܚ	q aː j ɪ ħ
منشي	m n ʃ i
جليد	d͡ʒ a l iː d
خوذة	x uː ð a
مترجم	m o t a ɾ d͡ʒ e m
رسیدلی	r s iː d l i
زنبق	z a m b a ɢ
ܡܩܕܘܢܝܐ	m ɑː q eː d o n iː j ɑː
ألقى	ʔ a l q aː
ד״ר	d o k t o ʁ
ܗܕܩ	h a d d ɪ q
بكارج	b a k aː r i d͡ʒ
ابتلى	i b t a l aː
وصیت	w ə s i t
بهر	b a h a r a
کېښودې	k e x o d e
רגש	ʁ ɛ ɡ ɛ ʃ
گواه	ɡ o v ɑː h
وېښتان	w e ʃ t̪ ɑ n
ابد	a b a d
بال	b ɑː l
فسح	f a s a ħ a
وترنرۍ	w t r n r ə i
چوگنا	t͡ʃ ɔː ɡ ʊ n a:
ٹھیک	ʈʰ iː k
ویلي	w i l i
قزاق	ɢ a z z ɑː ɢ
زبان	z a b ɑː n
ܓܢܨ	ɡ aː n ɪ sˤ
بوسكورة	b uː s k uː r a
روسيه	r u s j a
تيغار	t a j ɣ aː r
لمسی	l m a s a i
انھیں	ʊ n e:
شاپر	ʃ a: p ə ɽ
ܫܠܨ	ʃ aː l ɪ sˤ
جعفر	d͡ʒ a ʔ f a r
دیگر	d i ɡ a ɾ
کونکنی	k uː n k n iː
میراں	m iː r aː n
همت	h ə m t
لکیج	l ə k iː d͡ʒ
اداس	ʊ d a: s
ساتھی	s a: tʰ iː
می	m a j
قلقطار	q a l q a tˤ aː r
ܡܨܘܪܢܝܬܐ	m ə sˤ oː r ɑː n iː t ɑː
خاندان	x ɑː n d ɑː n
موسكو	m uː s k uː
کتراپی	k ʊ t ɽ a: p iː
ساعتونو	s ɑ ʕ t u n u
تعارف	t a ʔ ɑː ɾ u f
وکولیشم	w k o l i ʃ m
אגם	a ɡ a m
ראש	ʁ ɔ ʃ
ډېر	ɖ e r
سمو	s u m u w w
مدة	m a d d a
ڈیفنس	ɖ iː f n ɪ s
غداری	ɣ ə d aː ɽ iː
أشوس	ʔ a ʃ w a s
وحل	w a ħ l
رعراع	r a ʕ r aː ʕ
ویلو	w i l o
کاکوتی	k ɑː k uː t iː
كوسا	k uː s aː
لوبیا	l oː b ɪ j a:
ژر	ʐ ɾ
قايين	q aː j iː n
میٹابولائز	m eː ʈ a: b oː l aː ɪ z
ܙܝܥܐ	z a y ʕ aː
חמה	χ a m a
گونه	ɡ oː n a
אנגליה	ʔ ŋ ɡ l i j a
ویجاړونکی	w iː d͡ʒ ɑː ɻ o n k i
رہنمائے	ɽ ə ɦ n ə m aː ɪ
בלשנות	b a l ʃ a n u t
ܐܡܝܪܘܬܝܐ	ʔ a m i rː w ɑː θ ɑː j ɑː
ܪܐܚ	r aː ʔ e xː
ܕܪܓ	d a r r ɪ ɣ
حوضته	ħ o z t ɑ
څارویو	t͡s ɑ r o v i o
أرثوذكسي	ʔ u r θ uː ð u k s i j j
לכתוב	l i χ t ɔ v
ریکارڈس	ɽ eː k a: ɽ ʈ s
ناروغۍ	n ɑ r w ɣ e
شیر	ʃ iː ɽ
سینکڑا	s ɛː ŋ k ɽ a:
نيمبو	n i m b u
غونډیو	ɣ o n ɖ iː o
سندرې	s n d r e
رونق	ɾ a v n a ɢ
استخبار	i s t i x b aː r
رائےدہی	ɽ aː ɪ ə d ɦ iː
شرم	ʃ ə ɽ m
طنجيرة	tˤ a n d͡ʒ iː r a
حوضڅخه	ħ o ʈ͡s ə x a
غاړې	ɣ ɑː r ə
تايوان	t aː j w aː n
خزینه	x a z i n a
حرارت	x r ɑː r ʊ t
قدوائی	q ʊ d ʋ aː ɪ
مرنا	m ə ɽ n a:
کر	k a ɾ
רך	ʁ a χ
قندهار	q u n d u h aː r
کرون	k ɾ o n
ندا	n e d ɑː
کیا	k ɪ j a:
أكمون	ʔ a k m uː n
الہی	ʔ ɛː l ɦ iː
يم	j ə m
ܣܢܛ	s eː n tˤ ə
نادل	n aː d i l
الیکشن	a l iː k ʃ a n
שישה	ʃ i ʃ a
انجام	ə n d͡ʒ a: m
هیڅوک	h iː ʈ͡s w ə k
غافت	ɢ ɑː f e t
أكتوبر	ʔ a k t uː b a r
ܒܠܐ	b aː l aː
שכונה	ʃ χ u n a
خزیدن	x a z i d a n
صوف	sˤ a w i f a
ܦܪܫܝܬܐ	p r ɑ ʃː j ɑː t e
نائم	n aː ʔ i m
وینکٹیش	ʋ eː n k ʈ iː ʃ
موږ	m i ʒ
أفل	ʔ a f a l a
ܚܒܫ	x ɑː w e ʃː
استنشق	i s t a n ʃ a q a
بادام	b ɑː d ɑː m
ܨܘܐ	sˤ ɑː w eː
درملنه	d ə r m ə l ə n ə
בקבוק	b a k b u k
همزة	h a m z a
گرہن	ɡ ɽ ə ɦ ə n
ܒܘܪܟܬܐ	b u r k ə θ ɑː
ܟܡܐ	k ə m aː
پلورنځي	p l o r n ʐ i
شاخه	ʃ ɑː x e
دارد	d ɑː ɾ a d
حجم	ħ ə d͡ʒ m
סינכרן	s i n k r e n
لاما	l a: m a:
תפוז	t a p u z
ٹیکساس	ʈ iː k s a: s
لرغوني	l r ɣ u n i
ستايل	s t̪ ɑ j ə l
یومی	j oː m iː
فغفور	f a ɢ f uː ɾ
پړسوب	p a ɻ s o b
پولدار	p u l d ɑː ɾ
جنم	d͡ʒ ə n m
مرجان	m a r d͡ʒ aː n
نوٹس	n oː ʈ s
کمان	k ə m a: n
ܒܠܢܐ	b a l l ɑː n ɑː
סיפר	s i p ɛ ʁ
چنگال	t͡ʃ ə ŋ ɡ a: l
خطه	x a t t a
شبع	ʃ a b i ʕ a
دچار	d o t͡ʃ ɑː ɾ
بندر	b ə n d ə ɽ
عقدة	ʕ u q d a
اشترغار	o ʃ t o ɾ ɢ ɑː ɾ
نيلي	n i l i
زرقطونا	z a r q a tˤ uː n aː
کانټینرونه	k ɑː n ʈ iː n r w n ə
بهېږم	b a h e ɡ ə m
میرا	m eː ɽ a:
دیپک	d iː p ə k
دروغویل	d ə r o ɣ o w i l
مسكان	m u s k aː n
قذيفة	q a ð iː f a
ܟܘܙܐ	k uː z ɑː
انش	ə n ʃ
جفت	d͡ʒ o f t
سورج	s uː r d͡ʒ
هوښيارزیرک	h o ʈ͡ʂ j a r z i r k
רפאל	ʁ a f a ʔ e l
کړکۍ	k ə r k ə j
ارتعاش	ɪ ɽ t eː a: ʃ
صرع	s a ɾ ʔ
خباره	x a b ɑː ɾ a
ملوخيا	m u l uː x i j j aː
فانيذ	f aː n iː ð
میاشت	m i ɑ ʃ t
فیکلٹی	f iː k l ʈ iː
הבנה	h a v a n a
کاف	k ɑː f
برداشتن	b a ɾ d ɑː ʃ t a n
کارکرد	k a: r k ə r d
شمشار	ʃ a m ʃ aː r
اوپینین	oː p iː n iː n
کواری	k ʋ a: r iː
ספרדית	s f a ʁ a d i t
برسيم	b i r s iː m
آبدست	ɑː b d a s t
دادېوالو	d ɑː d e w ɑː l o
ܣܒܥ	s ɑ w eː
ܩܪܝܒܐ	q a r iː v ɑː
ديار	d i ɑ r
رقصة	r a q sˤ a
خراء	x i r aː ʔ
دیکھنا	d eː kʰ n a:
غافث	ɢ ɑː f e s
کار	k ɑ ɾ
کوششں	k oː ʃ ɪ ʃ a n
ܟܘܒܐ	k u b b ɑː
ناقد	n a: q ə d
لهجة	l a h d͡ʒ a
اجتماع	e d͡ʒ t e m ɑː ʔ
وموند	uː m uː n d
ܐܠܝܫܒܥ	eː l i ʃː w a ʕ
انقلاب	e n ɢ e l ɑː b
بنفسج	b a n a f s a d͡ʒ
تويول	t o j a w ə l
صالح	s a: l ɪ ɦ
איבוד	ʔ i b u d
سوله	s o l a
تمیزتر	t a m iː z t a ɾ
میان	m i j ɑː n
نجس‌تر	n a d ʒ a s t a ɾ
اجتماع	i d͡ʒ t i m aː ʕ
سور	s u r
چھڑکاؤ	t͡ʃʰ ɪ ɽ k a: oː
ناکامی	n a: k a: m iː
خيزران	x a j z u r aː n
حورس	ħ uː r u s
ܡܢܚ	m a n n ɪ x
مساواة	m u s aː w aː h
ܣܒܐ	s ɑː v ɑː
شداد	ʃ ə d aː d
ول	v e l
معاشرہ	m ʊ ʔ a: ʃ ɪ ɽ a:
اکابر	ʔ a: k a: b ɛː ɽ
ممنوعہ	m ə m n oː a ə ɦ
تعاقب	t a a: q ʊ b
أصفهان	ʔ a sˤ f a h aː n
مزری	m z a r a ɪ
ܒܪܛܠܐ	b a r tˤ ɪ l l aː
ܟܘܟܒܐ	k a w x ə v aː
سيرج	s a j r a d͡ʒ
اہلیہ	a: ɦ l iː a:
مبشرة	m i b ʃ a r a
سبلة	s a b l a
ܣܐܩ	s ɑː j ɪ qː
سینا	s iː n a:
ܡܫܡܫܢ	m ə ʃ a m ʃ ɪ n
ښکلیدیزه	ʂ k l i d i z ə
ناړولی	n ɑ ɻ a w ɘ l a i
نښه	n x a
ڈنکی	ɖ ə ŋ k iː
یائسگی	j ɑː ʔ i s a ɡ iː
تأوه	t a ʔ a w w a h a
تحاشى	t a ħ aː ʃ aː
ܡܢܐ	m ɑː n eː
مقشرة	m i q ʃ a r a
ܬܡܙ	t a m m i z
ܐܢܬ	ʔ a t
متجاوز	m ʊ t d͡ʒ a: ʋ ə z
نرکاشه	n ə r k ɑ ʃ a
زنګونو	z ə ŋ w ə n ə w
ܪܓܠܐ	r a d͡ʒ d͡ʒ ɑː l ɑː
خردل	x a ɾ d a l
ܡܝܠܐ	m iː l aː
لار	l ɑ r
خجالتی	x e d͡ʒ ɑː l a t iː
سفارشی	s e f ɑː ɾ e ʃ iː
עדכון	i d k u n
محبت	m ʊ ɦ ə b b ə t
چھینک	t͡ʃʰ i: k
ویلزه	w i l z ə
کچالو	k ʊ t͡ʃ ɑː l o
ارشد	a ɾ ʃ a d
متوفر	m u t a w a f f i r
هوښیاره	h o x j ɑ r ə
بھروسہ	bʰ ə ɽ oː s a:
ܫܒܛܢܝܐ	ʃ a v tˤ aː n aː j aː
باقة	b aː q a
مایوس۔کن	m aː j oː s k ʊ n
نستعلیق	n a s t a ʔ l i ɢ
شپې	ʃ p eː
نسيم	n a s iː m
ترجى	t a r a d͡ʒ d͡ʒ aː
قهوه‌ای	ɢ a h v a ʔ iː
أدحية	ʔ u d ħ i j a
התאבדות	h i t ʔ a b d u t
قابل	q a: b ɪ l
لوياثان	l a w i j aː θ aː n
گفتن	ɡ o f t a n
غواصة	ɣ a w w aː sˤ a
نفس	n ə f s
محول	m u ħ a w w i l
ټولنیزه	ʈ o l n i z a
کس	k ə s
کهکشان	k a h k a ʃ ɑː n
رب	ɾ a b
دبئی	d ʊ b ə iː
گودرز	ɡ oː d a ɾ z
ام	ɑ m
مظهر	m a ðˤ h a r
پلورونکي	p l o r o n k i
خردرلود	x ə r d̪ ə r l o d̪
ښځې	x ʈʂ e
په	p ə
اندرا	ɪ n d r a:
لابد	l ɑː b u d
اسٹون	ɪ s t oʊ n
کم‌کم	k a m k a m
آموختن	ɑː m oː x t a n
اندېښمن	ɑ n d̪ e x m n
خولنجان	x a w l a n d͡ʒ aː n
تنگ	t ə ŋ ɡ
غليون	ɣ a l j uː n
گیا	ɡ ə j a:
لبی	l a b iː
ܡܐܪܐ	m a ʔ r ɑ
بليز	b a l iː z
الصحه	ɑ l s ʕ h ə
ܒܘܬܨܘܢܐ	b oː t sˤ w ɑː n ɑː
تیرید	t iː r iː d
موادو	m o ɑ d o
گردوارہ	ɡ ʊ ɽ d ʋ a: ɽ a:
ܕܩܪ	d aː q e rː
منگنه	m a n ɡ a n a
انشقاق	i n ʃ i q aː q
یافتن	j ɑː f t a n
واد	w ɑː d
عليق	ʕ u l l a j q
گوسفند	ɡ oː s f a n d
ولاړیم	w ə l ɑ r i m
ܐܬܢܘܣ	ɑː t eː n o sː
ملت	m e l l a t
ښکارکوونکو	x k a ɾ k u w u n k u
موسیقی	m u s i ɢ iː
قارة	q aː r a
پلورونکي	p l ɔ ɾ w ə n k ə i
قلبی	ɢ a l b iː
ܡܓܘ	m ə ɡ oː
پنجه	p a n d͡ʒ a
ابتل	i b t a l l a
ܡܠܝ	m ɑː l iː
پله	p e l l e
پخپله	p ə x p ə l ə
חמש	x a m e ʃ
شوتالو	ʃ a w t̪ ɑ l u
أحد	ʔ a ħ a d
طاقت	t ɑː ɢ a t
تعلیم	t a ʔ l i m
أعجم	ʔ a ʕ d͡ʒ a m a
سامور	s aː m uː r
ستنه	s t ə n ə
كشتبان	k u ʃ t u b aː n
سړو	s ʊ r o
گنبد	ɡ o m b a d
ܡܘܥܕܐ	m ɑ w ʕ d aː
فنلندا	f i n l a n d aː
نشست	n ə ʃ ɪ s t
ܦܘܠܘܢܝܐ	p oː l oː n i j ɑː
اخذ	ə x z
ولاية	w a l aː j a
ܐܘܟܪܢܝܐ	ʔ u k r ɑː n i j ɑː
دقت	d e ɢ ɢ a t
عدالة	ʕ a d aː l a
ܟܘܬܩܐ	t͡ʃˤ o t q ɑː
سړه	s ə ɻ a
سلسله	s e l s e l e
څښاک	t͡s x ɑ k
کمیونٹی	k a m j uː n ɪ ʈ iː
دماغ	d a m ɑː ɢ
دیو	d i w
אבוד	ʔ a v u d
ܡܢܕܪܝܫ	m i d r e ʃː
ونډه	w ʊ n ʈ ə
غوا	ɣ w ɑ
ملیون	m l iː w n
مصحنة	m i sˤ ħ a n a
ܡܪܚܡ	m rˤ aː x ɪ m
کلنگ	k o l o n ɡ
شاورما	ʃ aː w a r m aː
دھو	dʰ uː
کیهانی	k a j h ɑː n iː
کیسی	k eɪ s iː
پلانٹ	p l a: n ʈ
فرقاطة	f i r q aː tˤ a
اونا	ɑ w n ɑ
انگلستان	ɪ ŋ ɡ l ɪ s t a: n
آشوب	ɑː ʃ oː b
نزهة	n u z h a
שתה	ʃ a t a
זהב	z a h a v
ܐܘܛܘܒܘܣ	ʔ oː tˤ oː b u s
گچ	ɡ a t͡ʃ
آسمانی	a: s m a: n iː
צימוקים	s i m u k i m
رابطہ	ɽ a: b t a:
تسلیم	t ə s l iː m
بالے	b a: l eː
ګهيځ	ɡ ə h i d͡z
זברה	z ɛ b ʁ a
ܗܝܓܗ	h iː ɡ ɑ hː
نجس‌ترین	n a d ʒ a s t a ɾ iː n
ܨܘܒܝܐ	sˤ oː b ɑː j ɑː
الإسكندرية	a l ʔ i s k a n d a r i j j a
طرمبة	tˤ r u m b a
דוב	d o v
רגל	ʁ ɛ ɡ ɛ l
بیلګه	b i l ɡ a
ܡܘܠܕܘܒܐ	m o l d oː v aː
تقني	t i q n i j j
زمااندازه	z m ɑ ɑ n d ɑ z ə
ܕܪܬܐ	d a r t a
گسترده	ɡ o s t a ɾ d e
خزان	x a z ɑː n
درلودو	d r l o d o
مجموعه	m a d͡ʒ m u ʔ a
קש	k a ʃ
دنیوی	d o n j a v e
عام	ʕ aː m
اوږدو	ɑ w ʒ d o
ناپدید	n ɑː p a d iː d
ونيو	w n i u
کوچس	k oː t͡ʃ ə s
مربا	m o r a b b ɑ
اوشه	o ʃ a
براشوت	b a r aː ʃ uː t
استعمال	ɪ s t eː m a: l
ساري	s ɑː r i
اصیل	a s i l
متقاضی	m ʊ t q aː z iː
ܐܢ	i n
מדע	m a d a ʕ
עברית	i v r i s
کهر	k a h a ɾ
مزه	m a z z a
ریکارڈز	ɽ eɪ k a: ɽ ɖ z
زنده	z e n d e
زكريا	z a k a r i j j aː
قابيل	q aː b iː l
سرباز	s a ɾ b ɑː z
ܐܨܠܐ	ʔ a sˤ l ɑː
مسؤل	m s ʔ l
بنجارا	b ə n d͡ʒ a: ɽ a:
مثال	m e s ɑː l
خطبقه	x t b q ə h
بغری	b a ɣ a r a ɪ
تقرح	t a q a r r a ħ a
ارتخى	i r t a x aː
ذروة	ð u r w a
تیروي	t i ɾ o j
مالک	m ɑ l ɪ k
ܚܠܒܐ	x a l w ɑː
مرد	m ə ɽ d
تناسق	t a n aː s u q
ܣܘܝܕܝܐ	s w a j ð ɑː j ɑː
לא	l o
نجلۍ	n d ʒ ə l ə i
غار	ɣ aː r a
شبح	ʃ a b a ħ
ܣܝܡܐ	s iː m ɑː
کسوویلزه	k s uː w iː l z h
تعزل	t a ʕ a z z a l a
پھیر	pʰ eː ɽ
هطلس	h a tˤ a l l a s
خنداندن	x a n d ɑː n d a n
خداج	x i d aː d͡ʒ
خوښشوم	x w ɔː ʂ w ə m
اتوار	ɪ t ʋ a: ɽ
אדמה	a d a m a
גוי	ɡ o j
خونریزی	x u n ɾ e z iː
ہاتھی	ɦ a: tʰ iː
فقر	f a ɢ ɾ
ܡܚܘܣܝܐ	m ħ u s s y aː
انٹرملان	ɪ n ʈ ə ɽ m ə l a: n
فأس	f a ʔ s
وهي	w ə h i
دد	d d
قوقعة	q a w q a ʕ a
ܡܠܟܐ	m a l k ɑː
موم	m uː m
عاشق	a aː ʃ ɪ q
ناهز	n aː h a z a
آستانه‌ای	ɑː s t ɑː n a iː
ܩܪܩܦܬܐ	q a r q a p t aː
دونا	d uː n a:
ܥܒܕܝܫܘܥ	ʔ oː d iː ʃ o ʔ
سمبال	s ə m b ɑ l
کارکردگی	k a: ɽ k ə ɽ d ə ɡ iː
افتادن	o f t ɑː d a n
حیواناتو	ħ i w ɑ n ɑ t o
ژررانه	ʒ r r ɑː n ə
نعناع	n a ʕ n aː ʕ
فلسطین	f ɪ l ɪ s t iː n
باردار	b ɑː ɾ d ɑː ɾ
צפון	sˤ aː ɸ oː n
نستعلیق	n ə s t a: l iː q
اړینه	ɑ ɽ i n ə h
مړشهیا	m r ʂ ə h j ɑ
غمی	ɣ a l m a i
خاصی	x a: s iː
ܬܠܬܥܣܪ	t ɪ l t a ʕ s a r
کاپٹر	k a: p ʈ ɽ
نصبین	n ə s b iː n
ܐܡܝܪܝܟܝܐ	ʔ ɑː m e r iː k ɑː j ɑː
رائے	ɽ a: j
سلطانية	s u l tˤ aː n i j j a
نماز	n a m ɑː z
خصومت	x o s uː m a t
سرفراز	s a ɾ f a ɾ ɑː z
حمیدالدین	ɦ ʊ m iː d a l d iː n
فتوى	f a t w aː
كوالا	k u w aː l aː
ارتاح	i r t aː ħ a
کپاسی	k ə p a: s iː
هزار	h a z ɑː ɾ
سيماء	s iː m aː ʔ
زهرجندی	z ə h r ʤ ə n d i
یکجا	j ə k d͡ʒ aː
اطباء	ɪ t ɪ b a: a:
بورسودان	b uː r s uː d aː n
اورید	ɑ w r i d
ܢܡܛܐ	n a m tˤ ɑː
مشورې	m ʂ o r e
لأن	l i ʔ a n n a
دبقي	d i b q i j j
باغوان	b ɑ ɣ w ɑ n
ܬܢܘܪܐ	t a n n uː r aː
آکرمن	a: k ɽ ə m ə n
ܙܥܦܪܢܐ	z a ʕ p r ɑː n ɑː
ܒܢܐܦܠ	b ɑː n iː p ɑ lː
سلیکشن	s ə l iː k ʃ ə n
بوخت	b o x t̪
ܩܦܠܐܘܢ	q iː p ɑː l iː j u n
خواب	x ɑː b
عربی	ʔ a ɾ a b iː
ارده	a ɾ d a
ܬܝܡܘܢ	t eː m u nː
صنایعو	s n ɑ j ʕ o
دركي	d a r a k i j j
ܥܠܝܐ	ʕ l aː j a
زامنود	z ɑː m n o d
براغ	b r aː ɣ
ܬܘܕܝܬܢܐܝܬ	t a w d iː t ɑː n ɑː ʔ iː t
تراجيديا	t r aː d͡ʒ iː d j aː
ܚܕܐ	x ð aː
בחור	b a ħ u r
غونډیو	ɣ o n ɖ i o
استغرق	i s t a ɣ r a q a
ܫܥܝ	ʃ ɑː ʕ a j
ونې	w n ɛ
کیمیاوي	k i m i ɑ w i
سہمنا	s ə ɦ ə m n a:
کتاب	k ɪ t a: b
ܬܪܡܠܐ	t a r m ɑː l ɑː
انگلینڈ	ɪ ŋ ɡ l ɛː n ɖ
ܚܡܫܬ	x a m ʃ a θː
خسارة	x a s aː r a
ندوة	n a d w a
بلاگ	b l ɑː ɡ
دردمند	d a ɾ d m a n d
پتلون	p ə t l uː n
عمری	a ʊ m r iː
اصلاح	e s l ɑː h
ژکفری	ʒ a k f a ɾ iː
ܓܠܓܠ	ɡ a l ɡ ɪ l
لوری	l oː ɽ iː
کمک	k o m a k
اوښانله	a w x ɑ n l ə h
وه	w h
ښود	x u d
ثاودسيوس	θ aː w u d u s i j uː s
اپارتمان	ɑː p ɑː r t m ɑː n
منفی	m a n f iː
ܬܝܡ	t ɑː j e mː
أكسح	ʔ a k s a ħ
اساس	ʔ ə s a: s
فاتر	f aː t i r
ܙܡܝܢܐ	z ə m iː n ɑː
ܠܦܐ	l a p p ɑː
أزرق	ʔ a z r a q
تڑت	t ə ɽ ɪ t
خصوص	x u sˤ uː sˤ
ܠܘܝܐ	l eː w ɑː j ɑː
ܛܫܐ	tˤ aː ʃ eː
ܬܩܢ	t a q q ɪ n
عرعر	ʕ a r ʕ a r
לקק	l i k e k
فشار	f e ʃ ɑː ɾ
ܐܬܝܪ	ʔ ɑː t i rː
پیشمرگه	p e ʃ m a ɾ ɡ e
شکلاتی	ʃ o k o l ɑ t i
انقضاض	i n q i dˤ aː dˤ
شته	ʃ t̪ e
خصية	x i sˤ j a
احتاز	i ħ t aː z a
اعتدى	i ʕ t a d aː
جلو	d͡ʒ e l o v
مصنوعات	m ʊ s n u: a a: t
گھرنا	ɡʰ ɽ ɪ n a:
ستان	e s t ɑː n
انتظام	ɪ n t ɪ z a: m
خسته‌خانه	x a s t a x ɑː n a
ضفدع	dˤ a f d a ʕ
مغناطيسية	m a ɣ n aː tˤ iː s i j j a
دمشق	d ə m ɪ ʃ q
درع	d a r r a ʕ a
خیریه	x a j ɾ i j j a
اصل	a s l
مند	m ʊ n d
עייף	ʕ a j a f
ܕܟܝܐ	d ɪ x j ɑː
جزدان	d͡ʒ o z d ɑː n
آکرشت	a: k ə ɽ ʂ ɪ t
أشرفي	ʔ a ʃ r a f i j j
إسكتلندا	ʔ i s k u t l a n d aː
تا	t ɑː
ترازو	t a ɾ ɑː z uː
مقدار	m i q d aː r
جی	d͡ʒ iː
باور	b ɑ w ə r
القرآن	a l q u r ʔ aː n
بندقاني	b u n d u q aː n iː
ګورې	ɡ o r e
قوانین	q ʋ aː n iː n
تمہارا	t ʊ m ɦ a: ɽ a:
منهج	m a n h a d͡ʒ
ناخواسته	n ɑː x ɑː s t a
تن	t ə n
كون	k a w n
ܡܪܒܐ	m a r b eː
جکړ	d͡ʒ a k a ɽ
هواء	h a w aː ʔ
ذال	ð aː l
ܣܥܪܬܐ	s ə ʕ a r t ɑː
آخ	ɑː x
نافرمان	n ɑː f a ɾ m ɑː n
أيل	ʔ a j j a l
کھیل	kʰ eː l
منوچهر	m a n u t͡ʃ e h ɾ
سفيه	s a f iː h
چاينک	t͡ʃ ɑ i n ə k
پولیو	p oː l iː oː
گودر	ɡ oː d a ɾ
باران	b ɑː ɾ ɑː n
ܐܩܠܐ	a q l ɑː
ناخوش	n a: x ʊ ʃ
شجر	ʃ ə d͡ʒ ə ɽ
דיו	d i j o
ܘܠܝܙܝܐ	w ɑː l i z ɑː j ɑː
منظم	m n ʐ m
اکسپریس	ə k s p eɪ r iː s
تود	t̪ o d̪
اقلیم	e ɢ l iː m
محسن	m o h s e n
ܣܓܕ	s aː x ɪ ð
كستبان	k u s t u b aː n
أنثوي	ʔ u n θ a w i j j
נפשט	n i f ʃ a t
خورن	x o r n
سهل	s a h l
نېغه	n ə ɣ ə
ܚܒܝܒܐ	x a b b iː w ɑː
رقيب	r a q iː b
גמל	d͡ʒ a mː ɔː l
ملکه	m l k ɛ
شین	ʃ iː n
ܨܢܥ	sˤ ɑː n e ʕː
ܐܠܦܝܢ	ʔ a l p e nː
ܝܗܘܐ	ʔ iː w ɑː
بچه	b a t t͡ʃ a
کبنیونکو	k b n i w o n k w o
زشت	z e ʃ t
حصرم	ħ a sˤ r a m
کوو	k o w
ساړه	s ɑ ɺ̢ ə
بی‌صدا	b e s a d ɑː
استفرغ	i s t a f r a ɣ a
النمسا	a n n a m s aː
ܗܝ	a j aː
تازگی	t ɑː z a ɡ iː
سگالیدن	s e ɡ ɑː l iː d a n
مدرسه	m a d ɾ a s a
زورق	z o v ɾ a ɢ
ګلابي	ɡ w ə l ɑ b i
ܡܟܬܒܬܐ	m a x t o t ɑː
خریدنا	x ə ɽ iː d n a:
سشما	s ʊ ʃ m a:
سميذ	s a m iː ð
ܡܟܡܥ	m a t s m e
مسقط	m ə s q ə t
اسطوره	o s t uː ɾ e
گذراننا	ɡ ʊ z ɽ a: n n a:
خواجه	x ɑː d͡ʒ a
عراقچی	a ɾ ɑː ɢ t͡ʃ iː
ارادہ	ʔ ɪ ɽ a: d ə
ܠܓܐ	l i d͡ʒ d͡ʒ ɑː
وو	w o
ܒܚܪܝܢ	b a x r e nː
می‌دوم	m i d a v a m
עצים	ʕ e t͡s i m
ڈوجی	ɖ oː d͡ʒ iː
بودن	b u d a n
وساتی	w s a t i
قائد	q aː ʔ i d
مرخېړی	m a r x e ɺ̢ a i
بہاؤالدین	b ə ɦ a: ʔ ʊ d d iː n
فاس	f ɑː s
ورکولې	w ə r k uː l e
ܝܡܝܢܐܝܬ	j a m m iː n ɑː ʔ i θː
مسله	m ə s l ə
پوٹےشیم	p oʊ ʈ eɪ ʃ iː m
ناچار	n ɑː t͡ʃ ɑː ɾ
אחדות	a χ d u t
فالودج	f aː l uː d a d͡ʒ
دفتری	d ə f t ə r iː
חסון	x a s o n
اتلاف	e t l ɑː f
جمہوریت	d͡ʒ ə m ɦ uː ɽ ɪ j ə t
بیمارترین	b iː m ɑː ɾ t a ɾ iː n
ܨܝܦܪܝܐ	sˤ iː p r ɑː j ɑː
چوبیس	t͡ʃ oː b iː s
حاجت	h ɑː d͡ʒ a t
مليکنه	m ə l i k ə n ə h
ترشا	t ə r ʃ ɑ
آرد	ɑː ɾ d
خیابان	x i j ɑː b ɑː n
اندېښمن	ɑ n d e x m ə n
ܪܚܘܩܐ	r a ħ uː q a
النکار	ə l ə ŋ k a: ɽ
תלוי	t a l u i
ټوټه	ʈ o ʈ ə
خواجہ	x a: d͡ʒ a:
جنت	d͡ʒ ə n ə t
اوږ	o ʐ
هدف	a d ə p
בקע	b a k a
يوه	j o h e
نوخر	n o x ə r
ضالين	dˤ aː l l iː n
سمرتی	ɪ s m ɽ ɪ t iː
نفقة	n a f a q a
آشوب‌ها	ɑː ʃ uː b h ɑː
خالی	x ɑː l iː
گلبرگہ	ɡ ʊ l b ə ɽ ɡ ə
گستردن	ɡ o s t a ɾ d a n
تمثیل	t a m s i l
سالگرد	s ɑː l ɡ a ɾ d
ویج	w i ʤ
أيقظ	ʔ a j q a ðˤ a
نمرکزونو	n m r k z u n u
مټ	m ə ʈ
شاي	ʃ aː j
רקע	r a k a
زميل	z a m iː l
حبس	ħ a b b a s a
زغمل	z ɣ a m ə l
هرگز	h a ɾ ɡ i z
راؤنڈر	ɽ a: ʊ n ɖ ə ɽ
ܦܐܪܐ	p a rˤ a
جې	d͡ʒ e
تهالك	t a h aː l a k a
یونانی	j u n ɑː n iː
وعدة	w a ʕ d a
أوضح	ʔ a w dˤ a ħ a
כוח	k o a χ
ثناخوان	s n a: x ʋ a: n
اندلع	i n d a l a ʕ a
اوښسپورچی	ɑ w x s p o r t͡ʃ i
اسپانچ	ɪ s p a: n t͡ʃ
ستاسې	s t ɑ s e
منفور	m a n f u ɾ
تنو	t n o
آبنوس	ɑː b n uː s
تبر	t a b a ɾ
برذعة	b a r ð a ʕ a
ܡܫܥܡܪ	m ə ʃ a ʕ m ɪ r
دیویندر	d eː ʋ iː n d ɽ
ܕܩܠܬ	d ɪ q l a t
راجستھان	ɽ a: d͡ʒ s tʰ a: n
ܚܕ	x a
מלחין	m a l χ i n
ܕܪܒܐ	d ɪ r b ɑː
پٹے	p a t eɪ
نسیم	n a s i m
ܣܢܣܪܐ	s ɪ n s aː r a
تسعون	t a s ʕ a w n a
مشى	m a ʃ aː
لږوو	l ə ʒ ə w
ܢܬܝܓܐ	n a t t iː d͡ʒ ɑː
نمط	n a m a tˤ
شوریدن	ʃ oː ɾ iː d a n
محمدقلی	m o h a m m a d ɢ o l iː
سوځولو	s o ʐ o l o
أفاد	ʔ a f aː d a
ܬܒܥ	t ɑː v eː
درشت	d o ɾ o ʃ t
طفيف	tˤ a f iː f
باجی	b ɑː d ʒ iː
لثه	l a s e
بامزه‌تر	b ɑː m a z e t a ɾ
نزدیک‌ترین	n a z d iː k t a ɾ iː n
فرشته	f a ɾ i ʃ t a
نوکرانو	n uː k r ɑː n u
ڈنکرک	ɖ ə n k ə ɽ k
فصح	f a sˤ u ħ a
گناه	ɡ o n ɑː h
فیلیپ	f i l i p
دماتولو	d m ɑ t w l w
سورپوستکي	s o r p o s t k i
ܦܘܪܬܩܠܬܐ	p u r t ə q ɑ l t ɑː
اظہر	ʔ ɪ z ʱ ə r
أخمص	ʔ a x m u sˤ
جهة	d͡ʒ i h a
بارش	b a: ɽ ɪ ʃ
کافر	k ɑː f e r
ہانگ	ɦ a: ŋ ɡ
عادل	ɑː d i l
مغلوب	m a ɣ l uː b
نسى	n a s s aː
پنیسر	p a n iː s ɛ r
سنبه	s o m b e
ܣܦܕܝܬܐ	s p a d iː θ a
بشرط	b ə ʃ ɽ ʈ
تمہیں	t ʊ m ɦ e:
دلگیر	d e l ɡ iː ɾ
ܚܪܝܦܐ	x a r r iː p ɑː
פטל	p e t e l
ܣܝܩܘܡܐ	s e̝ q oː m ɑː
ܥܓܒ	ʔ ɑ d͡ʒ i b
تروپتی	t r oʊ p t iː
عانى	ʕ aː n aː
مسمار	m i s m aː r
مړشو	m ɔ r ʃ ʊ
ځی	d͡z a i
دستوري	d u s t uː r i j j
شعر	ʃ eː ɽ
سپاہی	s ɪ p a: ɦ iː
واژه	v ɑː ʒ e
ډولهمېږيان	ɖ o l ə m ʐ i ɑ n
ܡܚܪܒ	m a x r u
دشمن	d ʊ ʃ m ə n
בשר	b aː s aː r
ناروغۍ	n ɑ r o ɣ ə i
پرځای	p r z aː j
میرزاخانی	m i ɾ z ɑː x ɑː n iː
شور	ʃ oː ɾ
سرو	s a r w
أسري	ʔ u s r i j j
قاموس	k ɑ m o s
هریو	h ə r i j o
دروغویل	d̪ r o ɣ o w i l
پنځه	p i n d z ə
ڈیولس	ɖ iː oː l s
כולם	k u l a m
رنگت	ɽ ə ŋ ɡ ə t
آلسی	a: l s iː
آيرلنډ	ɑ j r l ə n ɖ
ککړ	k k ɻ
ܩܗܐ	q a h eː
ܚܙܝܢܐ	x a z y ɑː n ɑː
خوراندن	x o ɾ ɑː n d a n
نگرانی	n ɪ ɡ ɽ a: n iː
خداوندی	x ʊ d a: ʋ ə n d iː
بتانا	b ɪ t a: n a:
کانفرنس	k a: n f ɽ ə n s
خرما	x o ɾ m ɑː
فجور	f u d͡ʒ uː r
לשמוע	l i ʃ m o a ʕ
لوړ	l w a ɻ
پنبه	p a m b e
جوړې	ʤ o ɻ e
ראשית	ʁ e̞ ʃ i t
هدس	h a d a s
گاز	ɡ ɑː z
کوې	k o e
دکار	d k ɑ r
گورو	ɡ ɔː ɽ ə ʋ
كرنيب	k a r n iː b
موحش	m uː ħ i ʃ
نمودار	n e m u d ɑː ɾ
مشترك	m u ʃ t a r a k
قفس	ɢ a f a s
اگرچہ	ə ɡ ə ɽ t͡ʃ eː
لائینز	l aɪ n z
غیر	ɣ ɛː ɽ
زیانونو	z i ɑ n o n o
ولایت	v e l ɑː j a t
إعلان	ʔ i ʕ l aː n
سربرآوردہ	s ɛ r b ɛ r a: ʋ ɛ r d a:
ܡܟܫܛ	m a k ʃ ɪ tˤ
کمرے	k ə m ɽ eː
شریعت	ʃ ə ɽ iː ʔ j ə t
اگر	ə ɡ ə ɽ
חנ״ג	x a n a ɡ
הועיל	h o ʔ i l
لاسلطوي	l aː s u l tˤ a w i j j
חנון	χ n u n
فرهود	f u r h uː d
بریالۍ	b ɾ j ɑ l ɛ
جو	d͡ʒ a v
دیوبندی	d eː ʋ b ə n d iː
כלבלב	k l a v l a v
فوج	f a v d͡ʒ
ܓܡܠܬܐ	ɡ ə m a l t ɑ
مضاربة	m u dˤ aː r a b a
كميت	k u m a j t
موافقه	m w ɑ f ɪ q ə
مسافة	m a s aː f a
محسن	m ʊ ɦ s ə n
بوییدن	b uː j iː d a n
ܒܨܠܐ	b ɪ sˤ l aː
دود	d̪ o d̪
