вівтарний	ʋ i u t ɛ r n ɪ i
прогнозів	p r ɔ ɦ n ɔ zʲ i u
дешевший	d ɪ ʃ ɛ u ʃ ɪ i
ватрушка	ʋ ɛ t r u ʃ k ɛ
характерний	x ɛ r ɛ k t ɛ r n ɪ i
розорений	r ɔ z ɔ r ɪ n ɪ i
галстук	ɦ ɑ ɫ s t u k
прабабуся	p r ɛ b ɛ b u sʲ ɛ
посталий	p ɔ s t ɑ ɫ ɪ i
зібратися	zʲ i b r ɑ t ɪ sʲ ɛ
період	p ɪ rʲ i ɔ d
рукою	r u k ɔ j u
школи	ʃ k ɔ ɫ ɪ
розпізнавання	r ɔ zʲ p i z n ɛ ʋ ɑ nʲ ɛ
кобальт	k ɔ b ɛ lʲ t
белград	b ɪ ɫ ɦ r ɑ d
трагедіє	t r ɛ ɦ ɛ dʲ i j ɪ
внесок	ʋ n ɛ s ɔ k
фінляндія	f i nʲ lʲ ɑ nʲ dʲ i j ɛ
сова	s ɔ ʋ ɑ
біднота	b i d n ɔ t ɛ
ідеалізм	i d ɪ ɛ lʲ i z m
родзинка	r ɔ d͡z ɪ n k ɛ
авансоутримувач	ɛ ʋ ɛ n s ɔ u t r ɪ m u ʋ ɛ t͡ʃ
погрожувати	p ɔ ɦ r ɔ ʒ u ʋ ɛ t ɪ
для	dʲ lʲ ɑ
морський	m ɔ r sʲ k ɪ i
парашутизм	p ɛ r ɛ ʃ u t ɪ z m
спричинювати	s p r ɪ t͡ʃ ɪ nʲ u ʋ ɛ t ɪ
уособлювати	u ɔ s ɔ b lʲ u ʋ ɛ t ɪ
абулія	ɛ b u lʲ i j ɛ
карликовий	k ɑ r ɫ ɪ k ɔ ʋ ɪ i
звук	z ʋ u k
широкомасштабний	ʃ ɪ r ɔ k ɔ m ɛ ʃ t ɑ b n ɪ i
фрагменти	f r ɛ ɦ m ɛ n t ɪ
негативно	n ɪ ɦ ɛ t ɪ u n ɔ
безтурботний	b ɪ z t u r b ɔ t n ɪ i
ґанок	ɡ ɑ n ɔ k
зоомагазин	z ɔ ɔ m ɛ ɦ ɛ z ɪ n
асимптота	ɛ s ɪ m p t ɔ t ɛ
ягода	j ɑ ɦ ɔ d ɛ
конотоп	k ɔ n ɔ t ɔ p
гель	ɦ ɛ lʲ
колись	k ɔ ɫ ɪ sʲ
забруднювати	z ɛ b r u dʲ nʲ u ʋ ɛ t ɪ
капуста	k ɛ p u s t ɛ
колонія	k ɔ ɫ ɔ nʲ i j ɛ
психологія	p s ɪ x ɔ ɫ ɔ ɦ i j ɛ
цап	t͡s ɑ p
скарб	s k ɑ r b
життєздатний	ʒ ɪ tʲ ɪ z d ɑ t n ɪ i
ламати	ɫ ɛ m ɑ t ɪ
підготовка	p i d ɦ ɔ t ɔ u k ɛ
покупець	p ɔ k u p ɛ t͡sʲ
воєнний	ʋ ɔ j ɛ n ɪ i
дебютувати	d ɪ b u t u ʋ ɑ t ɪ
численний	t͡ʃ ɪ s ɫ ɛ n ɪ i
оцією	ɔ t͡sʲ i j ɛ j u
домашнє	d ɔ m ɑ ʃ nʲ ɪ
давай	d ɛ ʋ ɑ i
зателефонувати	z ɛ t ɪ ɫ ɪ f ɔ n u ʋ ɑ t ɪ
синочок	s ɪ n ɔ t͡ʃ ɔ k
альбатрос	ɛ lʲ b ɛ t r ɔ s
психіка	p s ɪ x i k ɛ
несподіваний	n ɪ s p ɔ dʲ i ʋ ɛ n ɪ i
страхіття	s t r ɛ x i tʲ ɛ
східний	sʲ x i d n ɪ i
бельгійський	b ɪ lʲ ɦ i i sʲ k ɪ i
серце	s ɛ r t͡s ɪ
михайло	m ɪ x ɑ i ɫ ɔ
токсикологічний	t ɔ k s ɪ k ɔ ɫ ɔ ɦ i t͡ʃ n ɪ i
помста	p ɔ m s t ɛ
кораблебудівник	k ɔ r ɛ b ɫ ɪ b u dʲ i u n ɪ k
легеня	ɫ ɪ ɦ ɛ nʲ ɛ
матрьошка	m ɛ tʲ rʲ ɔ ʃ k ɛ
приємність	p r ɪ j ɛ m nʲ i sʲ tʲ
спора	s p ɔ r ɛ
культурний	k u lʲ t u r n ɪ i
власна	ʋ ɫ ɑ s n ɛ
шовковий	ʃ ɔ u k ɔ ʋ ɪ i
дорогий	d ɔ r ɔ ɦ ɪ i
шибеницями	ʃ ɪ b ɪ n ɪ t͡sʲ ɛ m ɪ
мокнути	m ɔ k n u t ɪ
сторож	s t ɔ r ɔ ʒ
пропорціям	p r ɔ p ɔ r t͡sʲ i j ɛ m
шестигранник	ʃ ɪ s t ɪ ɦ r ɑ n ɪ k
канадієць	k ɛ n ɛ dʲ i j ɪ t͡sʲ
ампер	ɛ m p ɛ r
панікерство	p ɛ nʲ i k ɛ r s t ʋ ɔ
іграшка	i ɦ r ɛ ʃ k ɛ
проблема	p r ɔ b ɫ ɛ m ɛ
житній	ʒ ɪ tʲ nʲ i i
постачати	p ɔ s t ɛ t͡ʃ ɑ t ɪ
бісексуал	b i s ɪ k s u ɑ ɫ
уникнути	u n ɪ k n u t ɪ
безнадійний	b ɪ z n ɛ dʲ i i n ɪ i
дровця	d r ɔ u t͡sʲ ɑ
крим	k r ɪ m
катастрофами	k ɛ t ɛ s t r ɔ f ɛ m ɪ
блокадами	b ɫ ɔ k ɑ d ɛ m ɪ
авіамаяк	ɛ ʋ i ɛ m ɛ j ɑ k
населити	n ɛ s ɪ ɫ ɪ t ɪ
трагедія	t r ɛ ɦ ɛ dʲ i j ɛ
клавіатурах	k ɫ ɛ ʋ i ɛ t u r ɛ x
термін	t ɛ r m i n
відсвяткувати	ʋ i d͡z sʲ ʋ ɛ t k u ʋ ɑ t ɪ
коса	k ɔ s ɑ
зворотний	z ʋ ɔ r ɔ t n ɪ i
інтуїтивно	i n t u j i t ɪ u n ɔ
чабер	t͡ʃ ɛ b ɛ r
ворота	ʋ ɔ r ɔ t ɛ
стакан	s t ɛ k ɑ n
гідравлічний	ɦ i d r ɛ u lʲ i t͡ʃ n ɪ i
сміх	sʲ m i x
літопис	lʲ i t ɔ p ɪ s
трагічний	t r ɛ ɦ i t͡ʃ n ɪ i
дивізіям	d ɪ ʋ i zʲ i j ɛ m
від'їбатися	ʋ i d j i b ɑ t ɪ sʲ ɛ
зірка	zʲ i r k ɛ
празник	p r ɑ z n ɪ k
ємен	j ɛ m ɪ n
соціальний	s ɔ t͡sʲ i ɑ lʲ n ɪ i
армія	ɑ r m i j ɛ
смерека	s m ɪ r ɛ k ɛ
втратити	ʋ t r ɑ t ɪ t ɪ
дебіл	d ɪ b i ɫ
монастир	m ɔ n ɛ s t ɪ r
календарем	k ɛ ɫ ɪ n d ɛ r ɛ m
кобальтовий	k ɔ b ɛ lʲ t ɔ ʋ ɪ i
інциденти	i n t͡s ɪ d ɛ n t ɪ
органів	ɔ r ɦ ɛ nʲ i u
льотчик	lʲ ɔ tʃ ɪ k
корисність	k ɔ r ɪ sʲ nʲ i sʲ tʲ
фабрика	f ɑ b r ɪ k ɛ
кухонний	k u x ɔ n ɪ i
бактерія	b ɛ k t ɛ rʲ i j ɛ
даремність	d ɛ r ɛ m nʲ i sʲ tʲ
кіт	k i t
тонкий	t ɔ n k ɪ i
спостерегти	s p ɔ s t ɪ r ɪ ɦ t ɪ
албанка	ɛ ɫ b ɑ n k ɛ
чиновниця	t͡ʃ ɪ n ɔ u n ɪ t͡sʲ ɛ
виглядати	ʋ ɪ ɦ lʲ ɛ d ɑ t ɪ
пестицид	p ɪ s t ɪ t͡s ɪ d
голодомор	ɦ ɔ ɫ ɔ d ɔ m ɔ r
славити	s ɫ ɑ ʋ ɪ t ɪ
докторат	d ɔ k t ɔ r ɑ t
знак	z n ɑ k
започаткувати	z ɛ p ɔ t͡ʃ ɛ t k u ʋ ɑ t ɪ
розв'язувати	r ɔ z ʋ j ɑ z u ʋ ɛ t ɪ
мандрувати	m ɛ n d r u ʋ ɑ t ɪ
олівець	ɔ lʲ i ʋ ɛ t͡sʲ
п'ятнадцятий	p j ɛ t n ɑ d͡zʲ t͡sʲ ɛ t ɪ i
вторгатися	ʋ t ɔ r ɦ ɑ t ɪ sʲ ɛ
найнижчий	n ɛ i n ɪ ʒ t͡ʃ ɪ i
діагностувати	dʲ i ɛ ɦ n ɔ s t u ʋ ɑ t ɪ
поняття	p ɔ nʲ ɑ tʲ ɛ
щиколотка	ʃ t͡ʃ ɪ k ɔ ɫ ɔ t k ɛ
переконати	p ɪ r ɪ k ɔ n ɑ t ɪ
фразеологічний	f r ɛ z ɪ ɔ ɫ ɔ ɦ i t͡ʃ n ɪ i
м'язові	m j ɑ z ɔ ʋ i
німа	nʲ i m ɑ
недільний	n ɪ dʲ i lʲ n ɪ i
акція	ɑ k t͡sʲ i j ɛ
вус	ʋ u s
активувати	ɛ k t ɪ ʋ u ʋ ɑ t ɪ
погуляти	p ɔ ɦ u lʲ ɑ t ɪ
родина	r ɔ d ɪ n ɛ
переддень	p ɪ r ɪ d ɛ nʲ
стілець	sʲ tʲ i ɫ ɛ t͡sʲ
гладіатор	ɦ ɫ ɛ dʲ i ɑ t ɔ r
щиколотки	ʃ t͡ʃ ɪ k ɔ ɫ ɔ t k ɪ
валець	ʋ ɛ ɫ ɛ t͡sʲ
молдавія	m ɔ ɫ d ɑ ʋ i j ɛ
парші	p ɑ r ʃ i
яничар	j ɛ n ɪ t͡ʃ ɑ r
компактний	k ɔ m p ɑ k t n ɪ i
акцентувати	ɛ k t͡s ɪ n t u ʋ ɑ t ɪ
спідницею	sʲ p i d n ɪ t͡s ɪ j u
ґринджоли	ɡ r ɪ n d͡ʒ ɔ ɫ ɪ
тощо	t ɔ ʃ t͡ʃ ɔ
перукарня	p ɪ r u k ɑ r nʲ ɛ
громико	ɦ r ɔ m ɪ k ɔ
гіперактивний	ɦ i p ɪ r ɛ k t ɪ u n ɪ i
чий	t͡ʃ ɪ i
марта	m ɑ r t ɛ
срібний	sʲ rʲ i b n ɪ i
вади	ʋ ɑ d ɪ
арахнологіє	ɛ r ɛ x n ɔ ɫ ɔ ɦ i j ɪ
монохромний	m ɔ n ɔ x r ɔ m n ɪ i
перевиховати	p ɪ r ɪ ʋ ɪ x ɔ ʋ ɛ t ɪ
норвежка	n ɔ r ʋ ɛ ʒ k ɛ
гони	ɦ ɔ n ɪ
квантова	k ʋ ɑ n t ɔ ʋ ɛ
нагадувати	n ɛ ɦ ɑ d u ʋ ɛ t ɪ
перебільшити	p ɪ r ɪ b i lʲ ʃ ɪ t ɪ
впевнений	ʋ p ɛ u n ɪ n ɪ i
впізнавати	ʋ p i z n ɛ ʋ ɑ t ɪ
пропозиціями	p r ɔ p ɔ z ɪ t͡sʲ i j ɛ m ɪ
загреб	z ɑ ɦ r ɪ b
старик	s t ɛ r ɪ k
утомлений	u t ɔ m ɫ ɪ n ɪ i
авантура	ɛ ʋ ɛ n t u r ɛ
картопля	k ɛ r t ɔ p lʲ ɛ
хлопчик	x ɫ ɔ p t͡ʃ ɪ k
непохитний	n ɪ p ɔ x ɪ t n ɪ i
застуджуватися	z ɛ s t u d͡ʒ u ʋ ɛ t ɪ sʲ ɛ
киплячий	k ɪ p lʲ ɑ t͡ʃ ɪ i
стимул	s t ɪ m u ɫ
молоти	m ɔ ɫ ɔ t ɪ
ик	ɪ k
противник	p r ɔ t ɪ u n ɪ k
взірець	ʋ zʲ i r ɛ t͡sʲ
плутократію	p ɫ u t ɔ k r ɑ tʲ i j u
особа	ɔ s ɔ b ɛ
таліях	t ɑ lʲ i j ɛ x
варіантові	ʋ ɛ rʲ i ɑ n t ɔ ʋ i
розглянути	r ɔ z ɦ lʲ ɑ n u t ɪ
територіальна	t ɪ r ɪ t ɔ rʲ i ɑ lʲ n ɛ
брамо	b r ɑ m ɔ
кість	k i sʲ tʲ
воротар	ʋ ɔ r ɔ t ɑ r
емігрувати	ɪ m i ɦ r u ʋ ɑ t ɪ
невидимий	n ɪ ʋ ɪ d ɪ m ɪ i
перевага	p ɪ r ɪ ʋ ɑ ɦ ɛ
затвердити	z ɛ t ʋ ɛ r d ɪ t ɪ
опубліковувати	ɔ p u b lʲ i k ɔ ʋ u ʋ ɛ t ɪ
рот	r ɔ t
задоволення	z ɛ d ɔ ʋ ɔ ɫ ɪ nʲ ɛ
українофоб	u k r ɛ j i n ɔ f ɔ b
монополіст	m ɔ n ɔ p ɔ lʲ i s t
соловейко	s ɔ ɫ ɔ ʋ ɛ i k ɔ
загальнонаціональний	z ɛ ɦ ɛ lʲ n ɔ n ɛ t͡sʲ i ɔ n ɑ lʲ n ɪ i
емоціє	ɪ m ɔ t͡sʲ i j ɪ
печивам	p ɛ t͡ʃ ɪ ʋ ɛ m
індустріалізувати	i n d u s tʲ rʲ i ɛ lʲ i z u ʋ ɑ t ɪ
заручати	z ɛ r u t͡ʃ ɑ t ɪ
правителька	p r ɛ ʋ ɪ t ɪ lʲ k ɛ
повставати	p ɔ u s t ɛ ʋ ɑ t ɪ
пацюк	p ɛ t͡sʲ u k
повідомлення	p ɔ ʋ i d ɔ m ɫ ɪ nʲ ɛ
скребти	s k r ɪ b t ɪ
метелик	m ɪ t ɛ ɫ ɪ k
гуляти	ɦ u lʲ ɑ t ɪ
райдуга	r ɑ i d u ɦ ɛ
виявитися	ʋ ɪ j ɛ ʋ ɪ t ɪ sʲ ɛ
пропозиції	p r ɔ p ɔ z ɪ t͡sʲ i j i
невідворотний	n ɪ ʋ i d ʋ ɔ r ɔ t n ɪ i
бонусами	b ɔ n u s ɛ m ɪ
штандарт	ʃ t ɛ n d ɑ r t
компенсація	k ɔ m p ɪ n s ɑ t͡sʲ i j ɛ
купальний	k u p ɑ lʲ n ɪ i
кожух	k ɔ ʒ u x
підтримувати	p i d t r ɪ m u ʋ ɛ t ɪ
візантійський	ʋ i z ɛ nʲ tʲ i i sʲ k ɪ i
проголошувати	p r ɔ ɦ ɔ ɫ ɔ ʃ u ʋ ɛ t ɪ
прекрасний	p r ɪ k r ɑ s n ɪ i
джгут	d͡ʒ ɦ u t
вигук	ʋ ɪ ɦ u k
абиколи	ɛ b ɪ k ɔ ɫ ɪ
погляд	p ɔ ɦ lʲ ɛ d
ради	r ɑ d ɪ
виріб	ʋ ɪ rʲ i b
монгольський	m ɔ n ɦ ɔ lʲ sʲ k ɪ i
сучасник	s u t͡ʃ ɑ s n ɪ k
акціонер	ɛ k t͡sʲ i ɔ n ɛ r
лівія	lʲ i ʋ i j ɛ
обмежувати	ɔ b m ɛ ʒ u ʋ ɛ t ɪ
самодержавство	s ɛ m ɔ d ɪ r ʒ ɑ u s t ʋ ɔ
функціональний	f u n k t͡sʲ i ɔ n ɑ lʲ n ɪ i
телевізійний	t ɪ ɫ ɪ ʋ i zʲ i i n ɪ i
супругою	s u p r u ɦ ɔ j u
прикро	p r ɪ k r ɔ
працівниками	p r ɛ t͡sʲ i u n ɪ k ɑ m ɪ
раніше	r ɛ nʲ i ʃ ɪ
афганістан	ɛ f ɦ ɛ nʲ i s t ɑ n
завершувати	z ɛ ʋ ɛ r ʃ u ʋ ɛ t ɪ
речення	r ɛ t͡ʃ ɪ nʲ ɛ
авгіїв	ɛ u ɦ i j i u
писар	p ɪ s ɛ r
першість	p ɛ r ʃ i sʲ tʲ
вірменія	ʋ i r m ɛ nʲ i j ɛ
природничий	p r ɪ r ɔ d n ɪ t͡ʃ ɪ i
перекладати	p ɪ r ɪ k ɫ ɛ d ɑ t ɪ
розбіжний	r ɔ zʲ b i ʒ n ɪ i
частка	t͡ʃ ɑ s t k ɛ
самостійність	s ɛ m ɔ sʲ tʲ i i nʲ i sʲ tʲ
економічний	ɪ k ɔ n ɔ m i t͡ʃ n ɪ i
просьба	p r ɔ zʲ b ɛ
мева	m ɛ ʋ ɛ
космологія	k ɔ s m ɔ ɫ ɔ ɦ i j ɛ
тисяч	t ɪ sʲ ɛ t͡ʃ
динамічно	d ɪ n ɛ m i t͡ʃ n ɔ
абатиса	ɛ b ɛ t ɪ s ɛ
мешкати	m ɛ ʃ k ɛ t ɪ
зупинятися	z u p ɪ nʲ ɑ t ɪ sʲ ɛ
використати	ʋ ɪ k ɔ r ɪ s t ɛ t ɪ
були	b u ɫ ɪ
постать	p ɔ s t ɛ tʲ
дефініцію	d ɪ f i nʲ i t͡sʲ i j u
англійка	ɛ n ɦ lʲ i i k ɛ
безглуздість	b ɪ z ɦ ɫ u zʲ dʲ i sʲ tʲ
холодно	x ɔ ɫ ɔ d n ɔ
рік	rʲ i k
вільнодумство	ʋ i lʲ n ɔ d u m s t ʋ ɔ
інтелектуальний	i n t ɪ ɫ ɪ k t u ɑ lʲ n ɪ i
каплиць	k ɛ p ɫ ɪ t͡sʲ
хімічний	x i m i t͡ʃ n ɪ i
споживач	s p ɔ ʒ ɪ ʋ ɑ t͡ʃ
корисний	k ɔ r ɪ s n ɪ i
декларативний	d ɪ k ɫ ɛ r ɛ t ɪ u n ɪ i
багатолітній	b ɛ ɦ ɛ t ɔ lʲ i tʲ nʲ i i
націоналістичний	n ɛ t͡sʲ i ɔ n ɛ lʲ i s t ɪ t͡ʃ n ɪ i
зоровий	z ɔ r ɔ ʋ ɪ i
мимоволі	m ɪ m ɔ ʋ ɔ lʲ i
фактично	f ɛ k t ɪ t͡ʃ n ɔ
відпочинок	ʋ i d p ɔ t͡ʃ ɪ n ɔ k
віртуальний	ʋ i r t u ɑ lʲ n ɪ i
сусідній	s u sʲ i dʲ nʲ i i
християнство	x r ɪ s t ɪ j ɑ n s t ʋ ɔ
слух	s ɫ u x
пісня	p i sʲ nʲ ɛ
формулювати	f ɔ r m u lʲ u ʋ ɑ t ɪ
рацію	r ɑ t͡sʲ i j u
працівником	p r ɛ t͡sʲ i u n ɪ k ɔ m
фінляндський	f i nʲ lʲ ɑ n d͡zʲ sʲ k ɪ i
відень	ʋ i d ɪ nʲ
внука	ʋ n u k ɛ
фізіологічний	f i zʲ i ɔ ɫ ɔ ɦ i t͡ʃ n ɪ i
заяць	z ɑ j ɛ t͡sʲ
когут	k ɔ ɦ u t
скроні	s k r ɔ nʲ i
корупція	k ɔ r u p t͡sʲ i j ɛ
феях	f ɛ j ɛ x
тлумачити	t ɫ u m ɑ t͡ʃ ɪ t ɪ
конфлікт	k ɔ n f lʲ i k t
кінчик	k i n t͡ʃ ɪ k
істина	i s t ɪ n ɛ
автовакцина	ɛ u t ɔ ʋ ɛ k t͡s ɪ n ɛ
мене	m ɪ n ɛ
восьмисот	ʋ ɔ sʲ m ɪ s ɔ t
репресивний	r ɪ p r ɪ s ɪ u n ɪ i
трав'яний	t r ɛ ʋ j ɛ n ɪ i
нього	nʲ ɔ ɦ ɔ
так	t ɑ k
літературний	lʲ i t ɪ r ɛ t u r n ɪ i
вітебськ	ʋ i t ɪ b sʲ k
стрічки	s tʲ rʲ i t͡ʃ k ɪ
нутрощі	n u t r ɔ ʃ t͡ʃʲ i
календарів	k ɛ ɫ ɪ n d ɛ rʲ i u
рейтузи	r ɪ i t u z ɪ
диспетчер	d ɪ s p ɛ tʃ ɪ r
дивізій	d ɪ ʋ i zʲ i i
установити	u s t ɛ n ɔ ʋ ɪ t ɪ
реєстрація	r ɪ j ɪ s t r ɑ t͡sʲ i j ɛ
кончина	k ɔ n t͡ʃ ɪ n ɛ
ізумрудний	i z u m r u d n ɪ i
автобусний	ɛ u t ɔ b u s n ɪ i
санкціонувати	s ɛ n k t͡sʲ i ɔ n u ʋ ɑ t ɪ
підлогу	p i d ɫ ɔ ɦ u
абсурдність	ɛ b s u r dʲ nʲ i sʲ tʲ
виразно	ʋ ɪ r ɑ z n ɔ
доброзичливиця	d ɔ b r ɔ z ɪ t͡ʃ ɫ ɪ ʋ ɪ t͡sʲ ɛ
позиція	p ɔ z ɪ t͡sʲ i j ɛ
паровоз	p ɛ r ɔ ʋ ɔ z
промокнути	p r ɔ m ɔ k n u t ɪ
внучка	ʋ n u t͡ʃ k ɛ
мід	m i d
артеріях	ɛ r t ɛ rʲ i j ɛ x
туреччина	t u r ɛ tʃ ɪ n ɛ
гендер	ɦ ɛ n d ɪ r
важко	ʋ ɑ ʒ k ɔ
посуд	p ɔ s u d
комбінація	k ɔ m b i n ɑ t͡sʲ i j ɛ
печив	p ɛ t͡ʃ ɪ u
незалежности	n ɪ z ɛ ɫ ɛ ʒ n ɔ s t ɪ
перевантаженість	p ɪ r ɪ ʋ ɛ n t ɑ ʒ ɪ nʲ i sʲ tʲ
виживати	ʋ ɪ ʒ ɪ ʋ ɑ t ɪ
допустити	d ɔ p u s t ɪ t ɪ
херсон	x ɪ r s ɔ n
вираз	ʋ ɪ r ɛ z
булава	b u ɫ ɛ ʋ ɑ
неформальний	n ɪ f ɔ r m ɑ lʲ n ɪ i
вищий	ʋ ɪ ʃ t͡ʃ ɪ i
феє	f ɛ j ɪ
абрикосник	ɛ b r ɪ k ɔ s n ɪ k
грішний	ɦ rʲ i ʃ n ɪ i
молекулярна	m ɔ ɫ ɪ k u lʲ ɑ r n ɛ
намібія	n ɛ m i b i j ɛ
передчасний	p ɪ r ɪ d͡ʒ t͡ʃ ɑ s n ɪ i
хронологія	x r ɔ n ɔ ɫ ɔ ɦ i j ɛ
металург	m ɪ t ɛ ɫ u r ɦ
сімсот	sʲ i m s ɔ t
патологічний	p ɛ t ɔ ɫ ɔ ɦ i t͡ʃ n ɪ i
діалог	dʲ i ɛ ɫ ɔ ɦ
еволюціонувати	ɪ ʋ ɔ lʲ u t͡sʲ i ɔ n u ʋ ɑ t ɪ
дев'яностий	d ɪ ʋ j ɛ n ɔ s t ɪ i
абсорбування	ɛ b s ɔ r b u ʋ ɑ nʲ ɛ
енциклопедист	ɪ n t͡s ɪ k ɫ ɔ p ɪ d ɪ s t
щокою	ʃ t͡ʃ ɔ k ɔ j u
руку	r u k u
жасмин	ʒ ɛ s m ɪ n
біологія	b i ɔ ɫ ɔ ɦ i j ɛ
неправду	n ɪ p r ɑ u d u
закінчення	z ɛ k i n t͡ʃ ɪ nʲ ɛ
завдання	z ɛ u d ɑ nʲ ɛ
інколи	i n k ɔ ɫ ɪ
сльозогінний	sʲ lʲ ɔ z ɔ ɦ i n ɪ i
вибрати	ʋ ɪ b r ɛ t ɪ
перевищувати	p ɪ r ɪ ʋ ɪ ʃ t͡ʃ u ʋ ɛ t ɪ
покій	p ɔ k i i
зимовий	z ɪ m ɔ ʋ ɪ i
зазначити	z ɛ z n ɛ t͡ʃ ɪ t ɪ
легеневий	ɫ ɪ ɦ ɪ n ɛ ʋ ɪ i
брак	b r ɑ k
двоповерховий	d ʋ ɔ p ɔ ʋ ɪ r x ɔ ʋ ɪ i
очиці	ɔ t͡ʃ ɪ t͡sʲ i
таліям	t ɑ lʲ i j ɛ m
гранатомет	ɦ r ɛ n ɛ t ɔ m ɛ t
масть	m ɑ sʲ tʲ
поєднання	p ɔ j ɪ d n ɑ nʲ ɛ
макові	m ɑ k ɔ ʋ i
мужність	m u ʒ nʲ i sʲ tʲ
ті	tʲ i
продуктивність	p r ɔ d u k t ɪ u nʲ i sʲ tʲ
очолити	ɔ t͡ʃ ɔ ɫ ɪ t ɪ
тісний	tʲ i s n ɪ i
зазначати	z ɛ z n ɛ t͡ʃ ɑ t ɪ
перевалювати	p ɪ r ɪ ʋ ɑ lʲ u ʋ ɛ t ɪ
фотографіями	f ɔ t ɔ ɦ r ɑ f i j ɛ m ɪ
фільтр	f i lʲ t r
стоматологія	s t ɔ m ɛ t ɔ ɫ ɔ ɦ i j ɛ
електрифікувати	ɪ ɫ ɪ k t r ɪ f i k u ʋ ɑ t ɪ
позбавити	p ɔ z b ɑ ʋ ɪ t ɪ
аваліст	ɛ ʋ ɛ lʲ i s t
неймовірний	n ɪ i m ɔ ʋ i r n ɪ i
неможливий	n ɪ m ɔ ʒ ɫ ɪ ʋ ɪ i
відродження	ʋ i d r ɔ d͡ʒ ɪ nʲ ɛ
інтерес	i n t ɪ r ɛ s
епох	ɪ p ɔ x
перевищити	p ɪ r ɪ ʋ ɪ ʃ t͡ʃ ɪ t ɪ
сатана	s ɛ t ɛ n ɑ
молитва	m ɔ ɫ ɪ t ʋ ɛ
артеріє	ɛ r t ɛ rʲ i j ɪ
ніс	nʲ i s
вельможа	ʋ ɪ lʲ m ɔ ʒ ɛ
пропозиція	p r ɔ p ɔ z ɪ t͡sʲ i j ɛ
прихильниця	p r ɪ x ɪ lʲ n ɪ t͡sʲ ɛ
авіапарк	ɛ ʋ i ɛ p ɑ r k
відпочилий	ʋ i d p ɔ t͡ʃ ɪ ɫ ɪ i
коротше	k ɔ r ɔ t͡ʃ ʃ ɪ
інерційний	i n ɪ r t͡sʲ i i n ɪ i
їй	j i i
ферзь	f ɛ r zʲ
кочерга	k ɔ t͡ʃ ɪ r ɦ ɑ
філософія	f i ɫ ɔ s ɔ f i j ɛ
індивідуально	i n d ɪ ʋ i d u ɑ lʲ n ɔ
руки	r u k ɪ
рівність	rʲ i u nʲ i sʲ tʲ
ворожість	ʋ ɔ r ɔ ʒʲ i sʲ tʲ
слимак	s ɫ ɪ m ɑ k
винайти	ʋ ɪ n ɛ i t ɪ
обмежень	ɔ b m ɛ ʒ ɪ nʲ
організацією	ɔ r ɦ ɛ nʲ i z ɑ t͡sʲ i j ɪ j u
нерішучість	n ɪ rʲ i ʃ u t͡ʃʲ i sʲ tʲ
прислівниковий	p r ɪ sʲ lʲ i u n ɪ k ɔ ʋ ɪ i
ресторан	r ɪ s t ɔ r ɑ n
меншина	m ɪ n ʃ ɪ n ɛ
карась	k ɛ r ɑ sʲ
втілити	ʋ tʲ i ɫ ɪ t ɪ
мелодіям	m ɪ ɫ ɔ dʲ i j ɛ m
скандинавія	s k ɛ n d ɪ n ɑ ʋ i j ɛ
селити	s ɪ ɫ ɪ t ɪ
кат	k ɑ t
забобон	z ɛ b ɔ b ɔ n
щоку	ʃ t͡ʃ ɔ k u
удосвіта	u d ɔ sʲ ʋ i t ɛ
абзац	ɛ b z ɑ t͡s
посадка	p ɔ s ɑ d k ɛ
революціонерка	r ɪ ʋ ɔ lʲ u t͡sʲ i ɔ n ɛ r k ɛ
стиль	s t ɪ lʲ
ідеалістичний	i d ɪ ɛ lʲ i s t ɪ t͡ʃ n ɪ i
долоням	d ɔ ɫ ɔ nʲ ɛ m
абандон	ɛ b ɛ n d ɔ n
генасамблея	ɦ ɪ n ɛ s ɛ m b ɫ ɛ j ɛ
привселюдний	p r ɪ u s ɪ lʲ u d n ɪ i
осінній	ɔ sʲ i nʲ i i
фільтрувати	f i lʲ t r u ʋ ɑ t ɪ
тисячоліть	t ɪ sʲ ɛ t͡ʃ ɔ lʲ i tʲ
панпсихізм	p ɛ n p s ɪ x i z m
перлина	p ɪ r ɫ ɪ n ɛ
попередній	p ɔ p ɪ r ɛ dʲ nʲ i i
покупка	p ɔ k u p k ɛ
емблематичний	ɪ m b ɫ ɪ m ɛ t ɪ t͡ʃ n ɪ i
агресивність	ɛ ɦ r ɪ s ɪ u nʲ i sʲ tʲ
русинка	r u s ɪ n k ɛ
оренда	ɔ r ɛ n d ɛ
автобальзам	ɛ u t ɔ b ɛ lʲ z ɑ m
синтезувати	s ɪ n t ɪ z u ʋ ɑ t ɪ
народитися	n ɛ r ɔ d ɪ t ɪ sʲ ɛ
трансформаціям	t r ɛ n s f ɔ r m ɑ t͡sʲ i j ɛ m
козел	k ɔ z ɛ ɫ
замовити	z ɛ m ɔ ʋ ɪ t ɪ
вугор	ʋ u ɦ ɔ r
упасти	u p ɑ s t ɪ
плуг	p ɫ u ɦ
сприйняття	s p r ɪ i nʲ ɛ tʲ ɑ
тридцять	t r ɪ d͡zʲ t͡sʲ ɛ tʲ
андріан	ɛ n dʲ rʲ i ɑ n
захворіти	z ɛ x ʋ ɔ rʲ i t ɪ
старіти	s t ɛ rʲ i t ɪ
свердловина	s ʋ ɪ r d ɫ ɔ ʋ ɪ n ɛ
вимираючий	ʋ ɪ m ɪ r ɑ j u t͡ʃ ɪ i
магніт	m ɛ ɦ nʲ i t
співрозмовник	sʲ p i u r ɔ z m ɔ u n ɪ k
тренер	t r ɛ n ɪ r
прагнення	p r ɑ ɦ n ɪ nʲ ɛ
ожина	ɔ ʒ ɪ n ɛ
лаванд	ɫ ɛ ʋ ɑ n d
сегрегація	s ɪ ɦ r ɪ ɦ ɑ t͡sʲ i j ɛ
усвідомлювати	u sʲ ʋ i d ɔ m lʲ u ʋ ɛ t ɪ
крохмаль	k r ɔ x m ɑ lʲ
крісло	k rʲ i s ɫ ɔ
чудище	t͡ʃ u d ɪ ʃ t͡ʃ ɪ
інвестувати	i n ʋ ɪ s t u ʋ ɑ t ɪ
вишити	ʋ ɪ ʃ ɪ t ɪ
петиціях	p ɪ t ɪ t͡sʲ i j ɛ x
еротика	ɪ r ɔ t ɪ k ɛ
легендарний	ɫ ɪ ɦ ɪ n d ɑ r n ɪ i
наявність	n ɛ j ɑ u nʲ i sʲ tʲ
відстояти	ʋ i d͡z s t ɔ j ɑ t ɪ
цвях	t͡sʲ ʋ ɑ x
нагромаджувати	n ɛ ɦ r ɔ m ɑ d͡ʒ u ʋ ɛ t ɪ
занотувати	z ɛ n ɔ t u ʋ ɑ t ɪ
лебідь	ɫ ɛ b i dʲ
кубічний	k u b i t͡ʃ n ɪ i
зекономити	z ɪ k ɔ n ɔ m ɪ t ɪ
залізо	z ɛ lʲ i z ɔ
знайомий	z n ɛ j ɔ m ɪ i
незалежносте	n ɪ z ɛ ɫ ɛ ʒ n ɔ s t ɪ
відвертати	ʋ i d ʋ ɪ r t ɑ t ɪ
видатний	ʋ ɪ d ɛ t n ɪ i
комедією	k ɔ m ɛ dʲ i j ɪ j u
скроням	s k r ɔ nʲ ɛ m
підприємство	p i d p r ɪ j ɛ m s t ʋ ɔ
кубанський	k u b ɑ nʲ sʲ k ɪ i
спідниці	sʲ p i d n ɪ t͡sʲ i
авіасалон	ɛ ʋ i ɛ s ɛ ɫ ɔ n
органи	ɔ r ɦ ɛ n ɪ
слухняний	s ɫ u x nʲ ɑ n ɪ i
спортсмен	s p ɔ r t͡s m ɛ n
можливий	m ɔ ʒ ɫ ɪ ʋ ɪ i
японія	j ɛ p ɔ nʲ i j ɛ
глядачка	ɦ lʲ ɛ d ɑ t͡ʃ k ɛ
білий	b i ɫ ɪ i
система	s ɪ s t ɛ m ɛ
хороший	x ɔ r ɔ ʃ ɪ i
геймплей	ɦ ɪ i m p ɫ ɛ i
безробітний	b ɪ z r ɔ b i t n ɪ i
тім	tʲ i m
лось	ɫ ɔ sʲ
обід	ɔ b i d
зобов'язання	z ɔ b ɔ ʋ j ɑ z ɛ nʲ ɛ
еякулювати	ɪ j ɛ k u lʲ u ʋ ɑ t ɪ
тацею	t ɑ t͡s ɪ j u
убогий	u b ɔ ɦ ɪ i
зад	z ɑ d
ложе	ɫ ɔ ʒ ɪ
починати	p ɔ t͡ʃ ɪ n ɑ t ɪ
абластика	ɛ b ɫ ɑ s t ɪ k ɛ
яма	j ɑ m ɛ
змусити	z m u s ɪ t ɪ
чотирьохсот	t͡ʃ ɔ t ɪ rʲ ɔ x s ɔ t
абсолютно	ɛ b s ɔ lʲ u t n ɔ
етика	ɛ t ɪ k ɛ
охороняти	ɔ x ɔ r ɔ nʲ ɑ t ɪ
інженерія	i n ʒ ɪ n ɛ rʲ i j ɛ
чемпіон	t͡ʃ ɪ m p i ɔ n
пробудження	p r ɔ b u d͡ʒ ɪ nʲ ɛ
хижак	x ɪ ʒ ɑ k
холодний	x ɔ ɫ ɔ d n ɪ i
містобудування	m i s t ɔ b u d u ʋ ɑ nʲ ɛ
централізація	t͡s ɪ n t r ɛ lʲ i z ɑ t͡sʲ i j ɛ
нестерпний	n ɪ s t ɛ r p n ɪ i
тунелях	t u n ɛ lʲ ɛ x
масштаб	m ɛ ʃ t ɑ b
п'єса	p j ɛ s ɛ
пакистан	p ɛ k ɪ s t ɑ n
оприлюднювати	ɔ p r ɪ lʲ u dʲ nʲ u ʋ ɛ t ɪ
пропорціях	p r ɔ p ɔ r t͡sʲ i j ɛ x
наркозалежний	n ɛ r k ɔ z ɛ ɫ ɛ ʒ n ɪ i
портативний	p ɔ r t ɛ t ɪ u n ɪ i
обґрунтовувати	ɔ b ɡ r u n t ɔ ʋ u ʋ ɛ t ɪ
подовження	p ɔ d ɔ u ʒ ɪ nʲ ɛ
разом	r ɑ z ɔ m
коліно	k ɔ lʲ i n ɔ
женевський	ʒ ɪ n ɛ u sʲ k ɪ i
внаслідок	ʋ n ɑ sʲ lʲ i d ɔ k
дитята	d ɪ tʲ ɑ t ɛ
абонент	ɛ b ɔ n ɛ n t
споживчий	s p ɔ ʒ ɪ u t͡ʃ ɪ i
ангольський	ɛ n ɦ ɔ lʲ sʲ k ɪ i
завойовувати	z ɛ ʋ ɔ j ɔ ʋ u ʋ ɛ t ɪ
ропуха	r ɔ p u x ɛ
абстрагованість	ɛ b s t r ɛ ɦ ɔ ʋ ɛ nʲ i sʲ tʲ
централізувати	t͡s ɪ n t r ɛ lʲ i z u ʋ ɑ t ɪ
словак	s ɫ ɔ ʋ ɑ k
референдум	r ɪ f ɪ r ɛ n d u m
вся	ʋ sʲ ɑ
ти	t ɪ
нирка	n ɪ r k ɛ
конлі	k ɔ nʲ lʲ i
безплатний	b ɪ z p ɫ ɑ t n ɪ i
рішити	rʲ i ʃ ɪ t ɪ
афаліна	ɛ f ɛ lʲ i n ɛ
заступник	z ɛ s t u p n ɪ k
слобода	s ɫ ɔ b ɔ d ɑ
район	r ɛ j ɔ n
чорниця	t͡ʃ ɔ r n ɪ t͡sʲ ɛ
дисципліна	d ɪ s t͡s ɪ p lʲ i n ɛ
захаренко	z ɛ x ɑ r ɪ n k ɔ
делегаціях	d ɪ ɫ ɪ ɦ ɑ t͡sʲ i j ɛ x
в'єтнамський	ʋ j ɪ t n ɑ m sʲ k ɪ i
авіапідживлення	ɛ ʋ i ɛ p i d͡ʒ ɪ u ɫ ɪ nʲ ɛ
пхати	p x ɑ t ɪ
паузами	p ɑ u z ɛ m ɪ
аріка	ɛ rʲ i k ɛ
користь	k ɔ r ɪ sʲ tʲ
сироватка	s ɪ r ɔ ʋ ɛ t k ɛ
одношлюбність	ɔ d n ɔ ʃ lʲ u b nʲ i sʲ tʲ
епохи	ɪ p ɔ x ɪ
систематизувати	s ɪ s t ɪ m ɛ t ɪ z u ʋ ɑ t ɪ
красний	k r ɑ s n ɪ i
заздрити	z ɑ z d r ɪ t ɪ
щука	ʃ t͡ʃ u k ɛ
королеві	k ɔ r ɔ ɫ ɛ ʋ i
модернізувати	m ɔ d ɪ r nʲ i z u ʋ ɑ t ɪ
вагання	ʋ ɛ ɦ ɑ nʲ ɛ
законодавиця	z ɛ k ɔ n ɔ d ɑ ʋ ɪ t͡sʲ ɛ
перебільшувати	p ɪ r ɪ b i lʲ ʃ u ʋ ɛ t ɪ
соловей	s ɔ ɫ ɔ ʋ ɛ i
фрустрація	f r u s t r ɑ t͡sʲ i j ɛ
відміну	ʋ i dʲ m i n u
польща	p ɔ lʲ ʃ t͡ʃ ɛ
горизонтами	ɦ ɔ r ɪ z ɔ n t ɛ m ɪ
незнання	n ɪ z n ɛ nʲ ɑ
абсурд	ɛ b s u r d
прибічниця	p r ɪ b i t͡ʃ n ɪ t͡sʲ ɛ
їжакевич	j i ʒ ɛ k ɛ ʋ ɪ t͡ʃ
кишеню	k ɪ ʃ ɛ nʲ u
виробництво	ʋ ɪ r ɔ b n ɪ t͡s t ʋ ɔ
сантиметр	s ɛ n t ɪ m ɛ t r
